headline,label
nevertheless the development can not be allowed to ruin the print newspaper which continues to be sanoma news main medium,neutral
operating profit totaled eur 5 5 mn up from eur 0 7 mn,positive
the product s front edge folding maximizes weather resilience and enables a seamless roof finish,neutral
the optimization of the steel components heating process will reduce the energy consumption,positive
yit lodged counter claims against neste oil totaling some eur25m primarily based on work carried out under the contract and additional costs incurred due to prolongation of the project,negative
stora enso has also had meetings with the labor authorities employment and economic development centres and representatives of the government in order to find solutions,neutral
nokia will continue to invest in future development of qt for the benefit of all users both commercial and lgpl,positive
neste oil corporation refining operation asset summary report summary neste oil corporation refining operation assets summary report is an essential source for company data and information,neutral
the decision of tekes was based on among other the following grounds : the project has a significant impact on the business development of the company,neutral
eurochem head of corporate finance alexander gavrilov said : i am pleased that we have once again confirmed that eurochem is able to attract long term funds at attractive rates,positive
the bank also expects additional costs related to the dash 8 q400 jets which the group shelved in october 2007,neutral
s business sectors are building construction infrastructure construction and technical building services,neutral
the start of the negotiations relating to glaston s efficiency program was announced in october,neutral
previously the plant was expected to be completed by the end of 2008,neutral
also a seven year historic analysis is provided for these markets,neutral
okhta center area is expected to have about 700 000 square metres of office premises by 2016,neutral
the markets are almost completely controlled by three banks : nordea op bank group and sampo,neutral
global banking news 28 september 2010 tieto corporation and pohjola bank pink : pojlf are to cooperate on swift services,positive
the business is organised as of february 1 2011 in a way that production of design services is combined into one entity etteplan operations,neutral
the contracts awarded to date in connection with the system amount to a total eur 36 million,neutral
the combined value of the planned investments is about eur 30mn,neutral
the sale of savcor face to cencorp will result in a profit or loss which can not yet be determined owing to factors including the valuation of the consideration shares to be received and prevailing exchange rates,neutral
the total value of the agreement is usd4 0 m the company said,neutral
of the company s net sales 38 was acquired in finland 21 in other european countries 40 in asia and 1 in the us,neutral
finnish automation solutions developer cencorp corporation omx helsinki : cnc1v issued on thursday 18 september a profit warning for the third quarter of 2008,negative
ruukki s delivery includes steel structures including installation for krakeroy bascule bridge and steel piles for the bridge foundations,neutral
russian officials inspected the damage and gave the vessel permission to continue to tallinn at around 4 30 a m the norwegian registered m t sten nordic was carrying 11 000 tons of gas oil and was manned by a filipino crew,neutral
the expanded agreement covers the sale marketing and distribution of benefon s navigation and locator devices in china,neutral
no financial details were available,neutral
finnish financial group aktia s operating profit for 2009 increased to eur 47 0 mn from eur 6 6 mn in 2008,positive
finnish vaahto group that provides paper making technology and process machinery is starting negotiations concerning the temporary lay offs of all 140 employees at the company s plants in hollola and tampere in finland,negative
outotec s delivery covers the engineering supply and construction of a circulating fluid bed calcination plant with a capacity of 1 600 tons of alumina per day,neutral
however simdax will remain available in the markets where it already has been approved as it has marketing authorisations or submitted applications in more than 40 countries orion added,positive
finnish printed circuit boards pcbs maker aspocomp group oyj said on december 4 2006 it named henry gilchrist senior vice president of the group s asian operations as of january 8 2007,neutral
after completion of the acquisition poyry s oil and gas expertise will cover multi discipline engineering and consulting services across the complete oil and gas asset lifecycle including deepwater engineering services,neutral
about dopplr dopplr is a service for smart travellers,neutral
finnish suominen corporation that specialises in wet wipes nonwovens and flexible packaging reports net sales of eur 44 1 mn in the second quarter of 2010 up from eur 43 3 mn in the second quarter of 2009,positive
these include software development for internet and mobile telephone content communications value added software financial services security applications systems integration and electronics ebrd informed,neutral
since the registration of the shares subscribed in a directed share issue the new number of panostaja shares and voting rights is 41 733 110,neutral
ova press has a 60 stake in the joint venture while imsm holds a 40 stake,neutral
cash flow from operating activities before investments was eur 7 6 million eur 2 5 million,neutral
both operating profit and turnover for the nine month period increased respectively from eur2 4 m and eur43 8 m as compared to the corresponding period a year ago,positive
oriola kd is a spin off of finnish pharmaceutical group orion oyj s wholesale division,neutral
finnish talvivaara mining co hel : tlv1v said thursday it had picked bofa merrill lynch and jpmorgan nyse : jpm as joint bookrunners of its planned issue of convertible notes worth up to eur250m usd332m,neutral
incap furniture is presently negotiating staff cuts,negative
in russia raisio s food division s home market stretches all the way to vladivostok,neutral
strategic and operational business information is objectively reported,neutral
the eur17m contract includes both design and construction works,neutral
the transaction is expected to be finalized by dec 2009,neutral
the business development initiatives in north america are headed by lynn shanahan,neutral
the finnish investment company sponda is conducting negotiations to acquire the business center dukat palace 2 located in the center of moscow from london & regional properties,neutral
paper companies were in negative territories with stora enso r shedding 1 62 pct to 12 73 eur upm kymmene down 0 80 pct at 18 64 eur and m real b 0 18 pct lower at 5 57 eur,negative
pharmaceutical market in netherlands global research & data services published recently a market analysis about the pharmaceutical markets in netherlands,neutral
active shipping is essential for finland,neutral
satama and trainers house will remain as names and independent brands of the business areas,neutral
the core of solidium s investment strategy is proper value enhancing asset management of the current holdings,positive
we make available the following brand new market analyses cement pakistan cement malaysia cement taiwan cement philippines these analyses give a clear overview of the actual situation and future outlook of the cement industry in some asian countries,neutral
the department store division reported an increase in sales of 4 per cent,positive
cramo group s financial targets for 2010 2013 are sales growth higher than 10 percent per year ; return on equity above 15 percent,positive
the current reference grade instruments are challenging to operate due to their high price and complexity for routine use,negative
the share of the share capital of both above mentioned shareholders remains below 5,neutral
according to business media reports usmanov planned to transfer his megafon stake to the state controlled svyazinvest in exchange for a stake in the merged rostelecom,neutral
the value of this kind of order amounts usually between euro 2 and 3 million,neutral
talvivaara is listed on the london stock exchange main market and nasdaq omx helsinki and is included in the ftse 250 index,neutral
profit before taxes was eur 5 4 mn up from eur 3 6 mn a year earlier,positive
the parties have agreed not to disclose the price of the deal the group said in a press release,neutral
finnish pharmaceuticals company orion s net sales rose to eur 190mn in the first quarter of 2009 from eur 180mn in the first quarter of 2008,positive
the new apartment block is going up very close to the city center explained chairman of the board of as yit ehitus priit sauk,neutral
the contract was signed in august with papua new guinea based lihir gold ltd asx : lgl,positive
finnish newspaper publisher sanoma of media group sanomawsoy is merging its free sheets uutislehti 100 and metro as of mid september 2008 to form a new free sheet to be named metro,neutral
according to the notification the holdings of ameriprice inc and its group companies are now in total 808 973 shares which represent 3 582 of tekla ¦ s shares and voting rights,neutral
the sale comprising the margarine business in finland and poland follows the approval of the polish competition authorities earlier in october,neutral
more than 80 special events in the three counties during four months were hosted by the library system and its nine branch libraries,neutral
pharmaceutical market in italy global research & data services published recently a market analysis about the pharmaceutical markets in italy,neutral
teleste bk optiflex amplifier products will be used in ongoing capacity upgrade of kdg s network to bi directionality,neutral
alexandria va oct 23 hans otto scheck of espoo finland has developed a method of identifying remote radio units in a communication system,neutral
elite residence tower a new development by tameer is located at the heart of dubai marina,neutral
3 january 2011 scandinavian lenders sampo bank hel : samas pohjola bank hel : poh1s and svenska handelsbanken sto : shb a have provided a eur160m usd213m line of credit to lemminkainen oyj hel : lem1s the finnish construction firm said on friday,neutral
at the end of march 2009 the company s loans amounted to eur 10 113 mn,neutral
in september 2010 the finnish group agreed to buy danish company rose poultry a s for up to eur23 9 m in a combination of cash and stock,positive
luna took fifth place on six under 207 a shot behind spain s beatriz recari and germany s martina eberl while welsh player becky brewerton was the highest placed british finisher sharing seventh place on three under 210 after shooting 71,neutral
bawag is to issue a benchmark covered deal,neutral
finnish forest machinery manufacturer ponsse s net sales grew to eur 51 3 mn in the first quarter of 2010 from eur 37 5 mn in the corresponding period in 2009,positive
a in august 2007 latvijas finieris ordered all production lines for a new green veneer mill to be built in ukmerge central lithuania,neutral
the order includes 48 ship cranes that will be delivered for 12 container feeders to be built at wenchong shipyard in china,neutral
the total restructuring costs are expected to be about eur 30mn of which eur 13 5 mn was booked in december 2008,neutral
elisa said mobile subscriptions grew 7 percent during 2007 mainly because of customers adopting so called third generation mobile technology,positive
changes to the as built models from the design were communicated to the subcontractors to accommodate them into the steel and grc glass reinforced concrete fabrication process,neutral
poyry is a global expert in consulting and engineering,neutral
amanda said that it had already made a usd5 0 m investment commitment in russia partners ii fund in july 2005,neutral
the omx helsinki index was down 0 34 pct at 8 256 02 on turnover of 813 191 mln eur,negative
the pilot project proved that rifd technology is ideal for our purposes comments olli saarinen material handling supervisor at yara,positive
the helsinki based company which also owns the salomon atomic and suunto brands said net profit rose 15 percent in the three months through dec 31 to x20ac 47 million $ 61us million from x20ac 40 8 million a year earlier,positive
capacity of the facility made by finland s vaahto group is 86 000 tons of light coated paper,neutral
their offering also covers localisation services related to production transfer to the finnish company s customers that already have production in asian market or have made the decision to transfer production there,neutral
yakima created the position for him after emerging from economic downturns of its own,neutral
adjustment to the fall in price level in contrast has been less effective,negative
both companies will keep their commercial independence and continue to market their traditional products individually,neutral
adp news nov 5 2008 finnish electronic measurement products and solutions maker vaisala oyj omx : vaias said today that its net profit rose to eur 18 million usd 23 1 m for the first nine months of 2008 from eur 1,positive
gs engineering will install the valves at a liquefied natural gas lng plant it has built for uae lng extraction and gas plants operator gasco in ruwais uae,neutral
the plant will collect raw material from the baltic sea region,neutral
raute said it has won an order worth around 15 mln eur to supply several plywood production lines to mills operated by russian wood products company sveza group,positive
the company recorded revenues of e658 1 million during the fiscal year ended december 2007 an increase of 23 over 2006,positive
in the reporting period net sales rose by 8 year on year to eur64 3 m due to the business acquisitions realized during the first half of 2008 09 the effect of which was eur10 9 m in the review period,positive
the company will use the money for product development and research activities through 2013 in its key markets finland germany italy and france,neutral
20 october 2010 finnish metal products company componenta oyj hel : cth1v said yesterday that its net loss narrowed to eur7m for the first nine months of 2010 from eur23 3 m for the same period of 2009,positive
the operating margin of aker yards cruise & ferries division went down from 8 3 to 6 4 in the first quarter of 2007,negative
lkab headquartered in lulea sweden is a high tech mining company producing upgraded iron ore products for the steel industry,neutral
less than ten people will face pension agreements,neutral
sales at the unit slumped last year after the industry was hit by poor snowfall in the major resorts in the winter of 2006 07,negative
finnish forestry company upm kymmene and waste management company lassila & tikanoja said on jan 30 they were planning to produce ethanol and energy from commercial and industrial waste,neutral
runway visual range is a calculated assessment of the distance that a pilot can see down a runway,neutral
device volume in the area decreased by 21 to 2 7 mn units,negative
the company supports its global customers in developing new technologies and offers a fast route from product development to applications and volume production,neutral
the difference can be explained by the fact that two shipping companies have stopped operating in the gulf of finland,neutral
currently the quarterly applied surcharges differ significantly from the actual market prices,neutral
the server is responsible for managing devices and user accounts and a desktop client application enables remote access to the mobile phones,neutral
other potential clients include public administration organizations investing in utility networks and services,neutral
in the beginning of the negotiations the estimated number of reductions was 50 at the maximum,neutral
the finnish government announced wednesday that it sold a 32 percent stake in chemicals and fertilizer group kemira oyj for x20ac 655 6 million $ 890us million sending the company s share price up 6 percent,positive
kirsi rantanen was previously development director for hk ruokatalo s poultry business,neutral
uponor made an operating profit of eur 151 0 mn up from eur 143 7 mn which made 2007 a record year,positive
previously it projected the figure to be slightly lower than in 2009,neutral
profit for the period was eur 5 9 mn up from eur 1 3 mn,positive
altia s operating profit jumped to eur 47 million from eur 6 6 million,positive
the airline was targeting travel agents tour operators and travel management companies to raise awareness first before targeting consumers he added,neutral
the fixed acquisition price amounts to nok 70 approximately eur 8 7 million and additional price nok 15 eur 1 8 million at maximum,neutral
zao yit moskovia builds housing in moscow and its surrounding cities,neutral
thanks to its extensive industry and operations experience cybercom offers strategic and technological expertise to these markets : telecom industry media public sector retail and banking and financial services,neutral
basware einvoices oy will be merged into the parent company during the present fiscal period,neutral
it offers advanced machinery maintenance and process development services to the pulp and paper industry in northern china,neutral
adpnews jul 17 2009 finland based steel maker rautaruukki oyj ruukki hel : rtrks said today it slipped to a net loss of eur 184 million usd 259 7 m for the first half of 2009 from a net profit of eur 2,negative
activities range from the development of natural resources to the retailed marketing of finished products,neutral
the company has 120 employees and annual sales of approximately eur16m,neutral
aspocomp has a large factory in china and a factory building project in india that was halted due to financing problems,negative
eqt has completed its exit from salcomp a finnish company that makes mobile phone chargers by selling its remaining stake to swedish investment group nordstjernan for about euro 35 million $ 47 million,neutral
componenta increased its stake in turkish steel company doktas dokumculuk ticaret ve sanayi a s to 92 6 pct stake in march 2007,positive
earnings per share for the quarter were also higher year on year at 0 33 eur versus 0 27 and above market expectations of 0 28 eur,positive
operating profit rose to eur2 4 m from eur1 6 m year earlier,positive
the mill will have capacity to produce 500 000 tonnes of pulp per year,neutral
the proportion of estonian and lithuanian passengers on the tallinn helsinki route also grew in july,positive
pretax profit totaled eur 9 0 mn down from eur 36 3 mn in 2007,negative
the inaugural speech will be given by hannu kyrolainen finland s ambassador to the czech republic,neutral
in q1 of 2009 bank of +àland s net interest income weakened by 10 to eur 9 1 mn,negative
after fixing our home base cutting costs and closing the non profitable units we are now looking at going forward she said,positive
consolidated pretax profit decreased by 69 2 to eur 41 0 mn from eur 133 1 mn in 2007,negative
antniemi refuted a report by the finnish daily turun sanomat as if the company was reorganizing its operations in the baltic countries,neutral
the company s board of directors would propose a dividend of eur0 15 per share for 2005,neutral
both companies existing investment plans will be coordinated,neutral
profitability ebit was 13 6 compared to 14 3 in q2 2009,negative
finnish bank of +àland reports its operating profit fell to eur 4 9 mn in the third quarter of 2007 from eur 5 6 mn in the third quarter of 2006,negative
nokia is just interested in bring nokia to the market,neutral
that s a very high figure on the european scale noop said recalling however that this also includes beer bought by finnish tourists,neutral
the selling consortium includes funds managed by oko bank s venture capital unit bio fund management and finnish industry investment a government owned investment group,neutral
r&d loan,neutral
the company operates through four principal divisions : consumer packaging ; office papers ; speciality papers as well as market pulp and energy,neutral
the government started the sell off last month putting an 8 percent stake in teliasonera on the auction bloc,neutral
a le coq special was developed for the bicentenary of the company and the trade mark the brewer said,neutral
in sales volume coca cola s market share has decreased by 2 2 to 24 2,negative
com and possibly also through photo msn,neutral
the company has exported into about twenty european countries as well as to africa,neutral
the use case dramatically narrows if you go only with the hot s ltd,neutral
the company is now withdrawing the second part eur 7 2 mn of the investment commitment,neutral
the following information was released by comptel : tomorrow the chairman of the federal communications commission is scheduled to deliver the national broadband plan to congress,neutral
the idea of saving electricity in data transfer is still a new one,neutral
the order also covers design services hardware software licences as well as maintenance services over six years,neutral
finnish shipping company finnlines of the grimaldi group reports its net sales decreased to eur 241 8 mn in january june 2009 from eur 384 0 mn in the corresponding period in 2008,negative
in january september 2010 fiskars net profit went up by 14 year on year to eur 65 4 million and net sales to eur 525 3 million from eur 487 7 million,positive
the company targets sales of ls 27 1 mn ls 23 498 mn and a profit of ls 300 000 ls 371 500 in 2007,neutral
the estonian electronic components factory elcoteq is running out of material because of the closure of air traffic,negative
oka specialises in new construction renovation work of residential and non residential building as well as premises for industrial and logistical use,neutral
the event can also be viewed as a live webcast at www cargotec com,neutral
the new office located in shenzhen will strengthen vaisala s already 10 year old presence in china,positive
with capman as a partner we will be able to further develop our business and continue to focus on providing quality restaurant services for our customers says christopher wynne ceo of papa john s russia,positive
the power generated annually by loviisa covers about 10 of finland s electricity consumption,neutral
i&h in a move to enhance growth,positive
however the net sales declined to eur 803 6 million from eur 1 2 billion,negative
the long standing partnership and commitment enable both parties to develop their respective operations and esl shipping will also have the opportunity to update its fleet and improve its efficiency,positive
the sale which will result in a gain of some eur 60 million in the second quarter of 2010 for oriola kd supports the finnish company s strategy to focus on pharmaceutical wholesale and retail operations,positive
adp news finnish handling systems provider cargotec oyj hel : cgcbv announced on friday it won orders worth eur 10 million usd 13 2 m to deliver linkspans to jordan morocco and ireland,positive
according to finnish scanfil s founder and chairman of the board jorma j takanen the company has to look for growth abroad,neutral
cash flow from operating activities is estimated to be positive,positive
fortum had intended to spend as much as euro 2 7 bn to become the sole owner of tgk 10,neutral
the order consists of outsourced application management support and planning for tecnotree and third party applications,neutral
pretax profit totalled eur 80 8 mn compared to a loss of eur 13 1 mn in the corresponding period in 2009,positive
the business units of the investlesprom group cover the full forest industry chain and the group owns forests sawmills paper and pulp mills and other processing plants,neutral
poyry is a global consulting and engineering firm focusing on the energy forest industry and infrastructure & environment sectors,neutral
the order was worth eur 8mn,neutral
cash flow from business operations totalled eur 0 4 mn compared to a negative eur 15 5 mn in the first half of 2008,positive
it generated an operating loss of eur 96 3 mn down from a profit of eur 43 9 mn,negative
in total more than 3000 surveillance cameras will be handled and managed according to a variety of needs the company said,neutral
we are now taking marimekko there on a distinctly more significant scale,neutral
besides pit produkt will enter the new segments,neutral
leed is an internationally recognized green building certification system developed by the u s green building council,neutral
the company booked april june new orders worth 949 mln eur compared with 786 mln eur in the same period a year ago,positive
we are very pleased with the fine co operation between the two countries in recent times he said,positive
igor and oleg yankov who currently manage moron and vitim will hold onto the 25 stake for now,neutral
both operating profit and net sales for the 12 month period increased respectively from eur4 7 m and eur26 7 m as compared to 2004,positive
delivery is expected to take place later this month,neutral
basic banking activities continued as normal,neutral
finnish holding company panostaja oyj said on june 12 2007 it has signed a letter of intent to acquire local lahden lampokasittely oy and heatmasters oy active in the heat treatment of metals for a total 3 1 mln euro $ 4 1 mln,neutral
due to the rapid decrease in net sales personnel reductions have been carried out on a wider scale than initially expected,negative
panostaja headquartered in tampere finland is an investment company focusing on small and medium sized finnish companies operating in the traditional industries,neutral
