headline,label
shareholder s full name and id code : petri ailus born 15 9 1966 for further information please contact isto hantila ceo tel +358 9 591 8342,neutral
london marketwatch share prices ended lower in london monday as a rebound in bank stocks failed to offset broader weakness for the ftse 100,negative
the sale will result in a capital loss of eur5m for solidium which obtained tikkurila shares in march 2010,negative
den bosch based tomtom is europe s largest maker of automotive navigation devices while cayman islands based garmin is larger in the u s and overall,neutral
net interest income increased by 4 5 to eur 31 4 mn from eur 30 0 mn in 2004,positive
operating profit decreased to eur 11 2 mn from eur 16 6 mn,negative
altogether finnair has canceled over 500 flights because of the strike,negative
country : ; germany sector : construction real estate ; machinery engineering target : caverion gmbh buyer : yit oyj deal size in usd : 90 3 m type : corporate acquisition status : agreed,neutral
the group posted net sales of 35 3 mln euro $ 46 5 mln and an operating profit of 760 000 euro $ 1 0 mln in 2005,neutral
the gypsii mobile social networking application is available in china with both chinese and english language support,neutral
the 2500 passenger ferry will have dimensions of 185 m length overall 170 m length between perpendiculars 27 70 m breadth and 6 55 m design draught,neutral
aspocomp said it will spin off its chinese and indian units and some equipment from its salo plant in finland into a newly formed unit most of which it will then sell on to hong kong listed meadville,neutral
the buy recommendation was reiterated,positive
finnair plc carried a record 8 8 million passengers in 2006 an increase of 3 5 percent on the previous year the finnish national carrier reported tuesday,positive
martela is a front runner in providing innovative solutions and customer service martela designs and supplies interior solutions for working environments and public spaces,neutral
the company also estimates the already carried out investments to lead to an increase in its net sales for 2010 from 2009 when they reached eur 141 7 million,positive
last july the group said it intended to relocate warehouse and office space in loudeac and saint marcel to morvillars in the east of france where it already operates a hook manufacturing and distribution unit,neutral
neste oil is working with over 20 research communities in europe america africa asia and australia to develop and introduce new raw materials,positive
financial details were not disclosed,neutral
kesko s car import and retailing business vv auto saw sales grow by 17 1 pct,positive
according to the company its operating profit excluding non recurring items in the fourth quarter of 2009 was significantly better than expected and also better than the figures for the fourth quarter of 2008,positive
15 december 2010 finnish german telecoms equipment maker nokia siemens networks said today it won a contract to upgrade the radio network of home based telecommunications company elisa oyj hel : eli1v,positive
a total of 140 jobs will be reduced at the raahe steel works,negative
the agreement includes application maintenance and support services,neutral
adp news feb 4 2009 finnish broadband data communication systems and solutions company teleste oyj hel : tlt1v said today its net profit decreased to eur 5 5 million usd 7 2 m for 2008 from eur 9 4 million for 200,negative
participants at any of the book discussions or other special events or visitors to the car dealership were eligible to enter the drawing for the 2005 silver four door altima,neutral
pearl plaza llc the joint venture of srv and shanghai industrial investment holdings co ltd has concluded the investment decision on construction of the first phase of the shopping center in saint petersburg russia,positive
it is hand painted resin with real 14 0 trebles and is 75cm long by 25cm deep from top to bottom of the middle hook,neutral
depending on the market situation such projects are sold after 1 to 3 years after completion,neutral
citigroup inc nyse : c has announced that its global transaction services gts business has been awarded a new mandate by finland based pohjola bank group,positive
the prosecutor is also demanding outokumpu pay a fine of eur 800 000 at most,negative
rfid radio frequency identification is a method of so called intelligent transport whereby information can be read and saved remotely,neutral
earnings per share eps amounted to eur1 37 down from eur2 30,negative
our research shows that access to information technology has been one of the limiting factors for most small businesses especially when they work in a heterogenous network based environment,neutral
incap headquartered in oulu finland is a electronics contract manufacturer with some 750 employees in finland estonia and india,neutral
the finnish company is building a 800 000 mt year biodiesel plant in singapore,neutral
performance is based on values and sustainability,neutral
in the second quarter of 2010 raute s net loss narrowed to eur 123 000 from eur 1 5 million in the same period of 2009,positive
salonen added that data shows producers pulp inventories in north america are declining,negative
the technology will become available to businesses from the fourth quarter nokia said,neutral
ceo erkki j+ñrvinen is happy with the company s performance in 2010,positive
this is the second successful effort for the financial investor this year,positive
in accordance with our strategy we strengthened our local presence by establishing a representative office in south africa in october,positive
the 3c expo is a signature show in dongguan which is supported by the dongguan municipal government every year featuring computer accessories software communication and network products,neutral
the implementation of these programs has had and will have negative impacts on 2006 and 2007 earnings mr meiklejohn said,negative
some 3 8 mln euro $ 5 2 mln of the base acquisition price will be paid in cash and the rest through a subscription offering of a total of 850 000 new ixonos shares,neutral
no financial details of the deployment were disclosed,neutral
in addition the contract includes modification of the effluent treatment plant at follum,neutral
finnish energy company fortum has set itself new stricter target limits for short term carbon dioxide emissions from its heat and electricity production,neutral
marathon estimates the value of its remaining stake in protalix at $ 27 million,neutral
quality chargers under chargz brand are sold in selected retail stores and other sales locations world wide,neutral
yit acquired investment rights to a 10 000 square metre residential project in yaroslavl and to a 16 400 square metre project in moscow,neutral
over the years the color orange has become synonymous with quality,neutral
in addition to fireplace exports demand for lining stone has exceeded the level of the earlier part of the year and will continue to be clearly brisker for the remainder of the year,positive
the plant is scheduled for completion in late february 2007 with hand over of some areas in january two other suppliers of nokia aspocomp group oyj and perlos have announced their plans to establish plants within the nokia complex together they will invest rs 365 crore,neutral
the borrower was happy to do the roadshow and this paid off as the hit ratio from it was high,positive
under the transaction agreement metsaliitto will purchase 24 7 of metsa botnia s shares from upm and 3 from m real,neutral
elisa corporation will disclose its financial statements for 2006 on thursday 8 february 2007,neutral
the company did not disclose the price of the acquisition,neutral
the service is intended to allow the people of thirteen mediterranean countries to reach the baltic more rapidly with a single carrier,positive
wayne greensmith fiskars brands uk senior brand manager said : we have launched this as we want to give something back to the community,neutral
biotie north american licensing partner somaxon pharmaceuticals started a phase ii iii clinical study in patients suffering from pathological gambling and a pilot phase ii study in nicotine addiction smoking cessation,neutral
the board established a remuneration committee with following members : sari baldauf chairman tapio hintikka heikki westerlund in addition the board decided to appoint a nomination committee at a later stage,neutral
finnish metal industry solutions supplier outotec oyj net profit rose to 50 4 mln euro $ 72 5 mln for the first nine months of 2007 from 20 1 mln euro $ 28 9 mln for the same period of 2006,positive
upm kymmene has generated thirty one consecutive quarters of positive ebitda,positive
the iso certification demonstrates that we are moving forward in our quality commitments to our customers,positive
pharmaceutical market in poland global research & data services published recently a market analysis about the pharmaceutical markets in poland,neutral
following the payment made in april the company has a total of eur 23 0 million in loans from financial institutions,neutral
alexandria va nov 5 risto kontturi of rajamaki finland and jari ylinen of hyvinkaa finland have developed an automated transportation system with a user controlled transport selection,neutral
the deal means that ten persons in three countries will transfer to tieto,neutral
the acquisition was financed with $ 2 56 billion of debt arranged by goldman sachs & co,neutral
the negotiations were carried out in a constructive manner and all parties tried to find a solution to the situation,positive
kazgiprotsvetmet and outotec finland have signed an agreement on strategic cooperation in the marketing and providing of minerals processing and metallurgical plants and related services in kazakhstan and the surrounding countries,positive
in the baltic countries atria s target is organic growth,neutral
nordea pankki suomi oyj according to previously announced has made forward contracts on alma media corporation shares,neutral
down to eur5 9 m h1 09 3 august 2009 finnish media group ilkka yhtyma oyj hel : ilk2s said today its net profit fell 45 on the year to eur5 9 m in the first half of 2009,negative
to be number one means creating added value for stakeholders in everything we do,neutral
n +1 group will pay eur16 5 m of the transaction price upon closing and the remaining sum in 2012,neutral
poyry plccompany announcement 10 december 2010 at 4 10 p m pursuant to poyry plc s stock option program 2004 63 792 new shares of the company have been subscribed since 27 october 2010 with stock options 2004b,neutral
net sales for the financial year 2006 are expected to amount to about eur20m and the operating result ebit is expected to be a loss as announced before,negative
at the same time i am delighted by the fact that we were able to accomplish the organization with our own team members,positive
sanoma corporation wants a new and better frequency for the helsinki metropolitan area,neutral
tornio works employs 2 300 of whom more than 1 800 have been in the scope of the fixed period or part time temporary layoffs in april october period,negative
the business idea of budget sport is to offer customers a wide range of high quality sports equipment and clothing at low prices the company said,neutral
ruukki announced that it has signed an agreement with aker solutions of norway to supply 24 suction anchors in september 2010 from its kalajoki unit in finland,positive
the study is expected to provide proof of pharmacodynamic activity in humans corroborate the safety profile and establish dose ranges for further therapeutic studies,neutral
reporting in accordance with the merged business operations will start as of january 1 2011,neutral
aspo plc stock exchange announcement may 4 2006 at 10:00 a m an increase in the share capital of aspo plc totaling eur 1 125 60 was registered today,positive
the order is a follow on to an 11 mln euro $ 16 1 mln deal made in july 2007,neutral
adp news feb 6 2009 finnish fishing tackle company rapala vmc corp hel : rap1v said today its net profit rose to eur 19 2 million usd 24 6 m for 2008 from eur 17 5 million for 2007,positive
rapala fishing frenzy 2009,neutral
the total emissions reduction from 1999 to 2017 will be thus 41,neutral
operating profit rose from eur 1 94 mn to eur 2 45 mn,positive
financial statements include the consolidated financial statements of the group the board of directors report the auditors report and the corporate governance statement,neutral
in sweden there is an oversupply of pharmacies,negative
lemcon signed an investment cooperation agreement with the kaluga regional administration last november,positive
motorola the world s second largest maker of cell phones unveiled the new phone tuesday in a bid to resurrect its ailing handset business,neutral
the share subscription period will expire on 30 september 2007,neutral
london afx fortum said it has agreed to sell its industrial maintenance service operations to funds managed by capman for an undisclosed sum,neutral
analysts surveyed by thomson financial expected revenue of $ 69 million for the quarter,neutral
the corresponding increase in the share capital due to these subscriptions with the warrants in total eur 1 860 74 was registered with the finnish trade register on january 4 2008,neutral
the company s profit totaled ls 578 100 in h1 2007 down 30 9 year on year,negative
cargotec s sales totalled eur 3 4 billion in 2008 and it employs approximately 10 500 people,neutral
after the sale outokumpu s share of the technology unit will be reduced to some 12 20 percent,neutral
the inventors are bylander johan ponten fredrik and lundberg jorgen,neutral
sales were down 14 per cent in finland and up 27 per cent abroad where sales were lifted by the strong growth in sales in russia and lithuania,neutral
1 february 2011 finnish textile and clothing company marimekko oyj hel : mmo1v said today its preliminary operating profit grew to eur8 2 m in 2010 from eur6 3 m in 2009,positive
m real s sales are expected to have increased by 4 year on year to eur609m in the second quarter of 2010,positive
teliasonera has secured deliveries for 4g modems with support for 3g and 2g during the second quarter 2010,positive
the total investment in the company will be eur58m of which wartsila s share will be eur29m,neutral
of course you ll have direct access to nokia s ovi store so you ll have lots of fun downloading your favorite media,neutral
curators have divided their material into eight themes,neutral
i am looking forward to contribute to srv s success with my competence says taneli hassinen,positive
the stock is trading above both its maps and the 50 day map of sek72 983 is higher than the 200 day map of sek70 283 a bullish indicator,positive
salcomp oyj the finnish maker of mobile phone chargers monday posted a eur1 49 million loss in the second quarter compared with a 1 70 million profit in the same period the previous year,negative
stockmann and swedish sector company ab lindex entered into an agreement on september 30 2007 whereby stockmann or a wholly owned subsidiary of it will make a public tender offer for all of lindex s issued shares,positive
the company plans to increase the unit s specialist staff to several dozen depending on the market situation during 2010,neutral
this corrensponds to 4 628 percent of okmetic s share capital and voting rights,neutral
the estimated turnover of the new company is lvl 2 5 million eek 40 million,neutral
the value of the order is about eur 30mn,neutral
in 2008 the deal is likely to bring savings of eur 20mn 25mn,positive
s group s loyal customer magazine yhteishyv+ñ came second with 1 629 000 readers and sanoma corporation s daily newspaper helsingin sanomat was third with 1 097 000 readers,neutral
teleste s hybrid tv solution includes components for the whole process of delivering video services to consumers from content acquisition and service creation to delivery through a range of access solutions including hfc hybrid fibre coaxial xdsl etth and ftth,neutral
according to pkc the acquisition would bring a significant addition to pkc s customer base,positive
cencorp estimates that its net sales in the last quarter will be as earlier stated eur4 3 m to eur5 0 m and operating profit ebit is estimated to be positive,positive
the 10 000 odd square metre plot that stockmann has bought for the nevsky center shopping center is located on nevsky prospect st petersburg s high street next to the vosstaniya square underground station in the immediate vicinity of moscow station,neutral
finnish cutlery and hand tools maker fiskars oyj abp hel : fisas said today its net profit rose to eur 24 1 million usd 33 6 m in the third quarter of 2010 from eur 17 9 million a year earlier,positive
according to the company in addition to normal seasonal fluctuation the market situation has weakened during autumn 2008,negative
in finland export industry forms a large clientele for the packaging industry,neutral
vaisala s net profit for the third quarter of 2007 dropped to 3 0 mln euro $ 4 3 mln from 6 8 mln euro $ 9 8 mln for the same period of 2006,negative
this implementation is very important to the operator since it is about to launch its fixed to mobile convergence service in brazil see brazil : 8 may 2006 :,neutral
affecto has participated in the program for the development of the norwegian pension system since 2007,neutral
according to hkscan finland the plan is to increase j+ñrvi suomen portti s net sales to eur 80mn to eur 100mn,positive
brazilian mobile player telemig celular yesterday announced that it has selected finnish software developer tecnomen oyj to expand its prepaid billing system,positive
sponda is a property investment company specialising in commercial properties in the largest cities in finland and russia,neutral
finnlines said that the deal is part of its strategy to focus on its core businesses,neutral
upm kymmene upgraded to in line from underperform by goldman sachs,positive
as a result 12 people will be made redundant and a total of 67 persons are laid off temporarily,negative
biohit already services many current genesis customers and the customer base is expected to expand as a result of this agreement,positive
thanks to his wide contact network and good knowledge of market and business environment he will give a great contribution to the further development of our indian operations tells incap s president & ceo juhani hanninen,positive
fl group s private equity division manages all operating companies including icelandair group fl travel group bluebird and sterling,neutral
in november the finnish government decreased its ownership in the company further to 31 1 percent from 38 percent,neutral
finnish fibers and plastics producer suominen corporation omx helsinki : suy1v reported on wednesday 22 october an operating loss of eur0 8 m on net sales of eur55 2 m for the third quarter of 2008,neutral
altona stated that the private company of altona chairman kevin maloney tulla resources would take up its entitlement in full,neutral
isms does not disclose its financial results the daily said,neutral
a meeting of glisten shareholders to vote on the bid will be held on 12 march,neutral
in january traffic measured in revenue passenger kilometres rpk went up by 3 2 and capacity measured in available seat kilometres ask rose by 12 2,positive
because the application can be considered as a hacking application it is classified by f secure as riskware,neutral
eps dropped to eur0 2 from eur0 3,negative
the firm s uk head office is in rugby road lutterworth,neutral
passenger volumes rose by 8 4 in the accounting period,positive
the solution will be installed in the usa to support the north american operations of the customer,neutral
we respect their decision the discussions are now closed said kai telanne alma media s ceo,neutral
the finnish group anticipates a sales gain of eur42m after tax and expenses,positive
operating profit totaled eur 825mn up from eur 763mn in 2004,positive
belarus oao lidskoe pivo brewery based in the grodno region reported a 1 1 decrease in output to 1 045 million decaliters in january march 2010 a representative in the administration of the company told,negative
ixonos will finance the acquisition through a 3 8 mln euro $ 5 2 mln loan,neutral
operating profit rose to eur 1 6 mn from eur 1 1 mn in the corresponding period in 2006,positive
finnish cargotec s kalmar has received a significant order from the us department of defense,positive
an acquisition of teliasonera would be france telecom s biggest since its 2000 purchase of orange plc for 27 8 billion $ 55 1 billion and would create the world s fourth largest telecom company behind at&t inc verizon communications inc and ntt corp of japan,neutral
in 2005 the bank posted a net profit of lt 8 2 mn,neutral
the combined activities will create value for shareholders and be good for our employees and customers,positive
the online ice chart shows no ice in the area of estonia s sea ports on the coast of the gulf of finland,neutral
componenta has production lines for similar sized products at karkkila in finland at weert in the netherlands and at orhangazi in turkey and these had a combined output of approximately 100 000 tonnes and net sales of eur 135 million in 2007,neutral
finnish investment group neomarkka oyj hel : nembv said today that it will buy the former production facilities of kuitu finland ltd as part of negotiations on the option to invest in specialty cellulose fiber business,neutral
sampo group that has become a major shareholder in nordea owns trygvesta s main competitor if p & c insurance,neutral
through the nordic exchange omx offers access to approximately 80 percent of the nordic and baltic securities market,neutral
the move will be carried out by transferring hkscan s production related property plant equipment as well as its holdings in subsidiaries and associate companies in the country to hkscan finland,neutral
according to finnish aktia bank s managing director jussi laitinen the bank s aim is to triple the number of its customers in finland in the next five years,positive
the company closed last year with a turnover of about four million euros,neutral
vaisala s present weather detector measures visibility up to 20 km as well as precipitation type and intensity,neutral
the address location is provided to a local controller preferably by wireless transmission which then uses the address location to access the appliance control module,neutral
the construction project is scheduled to start in the second quarter of 2009 and the new building is scheduled to be in place by the end of 2010,neutral
subscription sales decreased slightly,negative
of bavelloni s and nst s joint ventures bavelloni tools completes semiproducts that are produced in italy into high quality tools that will be sold under the diapol brand,neutral
however the rapidly increasing costs and the strengthening of the euro were challenging for the whole industry and they impacted on our results,negative
the power supplies dc power systems and inverters designed and manufactured by efore and systems incorporating them are used in many different applications,neutral
to see more of new haven register or to subscribe to the newspaper,neutral
the exercise originated in finland in the early 1930s as a training method for cross country skiers,neutral
the company s market share is continued to increase further,positive
according to swedish authorities traces of the very toxic osmium tetroxide have been found on the coast of per+ñmeri the northernmost part of the gulf of bothnia,negative
the company confirmed its estimate for lower revenue for the whole 2009 than the year ago eur93 9 m as given in the interim report on 5 august 2009,negative
estonia s beer market overall grew three percent last year to 130 million liters,positive
the majority of the company s personnel in finland is temporarily laid off from one to six weeks in the period from february to june 2009 period,negative
nokia s calling all innovators africa competition has been specifically launched to enable developers to create locally relevant best of breed mobile applications,positive
the value of the contract is eur 25mn,neutral
the effect may remain short lived however,neutral
according to gallup food and farm facts beef consumption totaled 99mn kilos in finland in 2007,neutral
the figure does not include food exports from finland,neutral
the airline has ordered nine airbus a350 900 aircraft with deliveries from 2011 and in doing so becomes the lead airline for the latest variant of rolls royce trent series engines called the 1700,positive
for telenor the three and a half year contract is worth an estimated 12 6 m yit has chosen telenor and elisa as its principal suppliers of ict solutions in norway sweden denmark and finland,positive
customers include hotels and restaurants as well as wholesalers and some retailers,neutral
teliasonera tlsn said the offer is in line with its strategy to increase its ownership in core business holdings and would strengthen eesti telekom s offering to its customers,positive
according to latest information benefon will launch its twig device on 20 september 2006,neutral
among the scandinavian companies present in st petersburg is also named the swedish concern ncc which implements projects in the field of asphalt production road and housing construction project swedish krona,neutral
investors will continue being interested in the company s share although it is not quite cheap affarsvarlden said,positive
people who enjoy mobile games are often the same customers who enjoy experimenting with new mobile services and content,neutral
for 2009 incap expects revenue of some eur 70 million,neutral
