headline,label
incap contract manufacturing services pvt ltd a subsidiary of incap corporation of finland plans to double its revenues by 2007 2008,positive
no financial or pricing details were disclosed,neutral
this new deal has strengthened the partnership from telemig celular and tecnomen which it has started since the beginning of telemig s prepaid operations,positive
mr kivimeister said john deer former timberjack stands to win in the situation : it controls around 60 of estonia s forest machinery market,positive
viking will pay eur 130 million for the new ship which will be completed in january 2008,neutral
in january june 2010 diluted loss per share stood at eur0 3 versus eur0 1 in the first half of 2009,negative
there have not been previous share subscriptions with 2004 stock options,neutral
secure your files online like filling out a tax return making a backup is boring,neutral
when open next year it will be the largest facility in the world to produce diesel fuel from renewable feedstock such as palm oil and animal fat,positive
finnish electronics contract maker incap oyj said on january 3 2008 it sold its manufacturing facilities in helsinki to local real estate company sponda oyj for 5 3 mln euro $ 7 8 mln,neutral
the company is in the process of building a new fleet and has placed orders for 10 p max tankers of 65 200 dwt,positive
the talks involved the food and ingredients divisions as well as group service functions the company said,neutral
glaston s share gla1v is listed on the nasdaq omx helsinki mid cap list,neutral
the economic development and trade ministry and industry and energy ministry along with the kostroma regional administration and the russian lumberman and timber exporters union has been carrying out work to acquire investment for the construction of a pulp and paper mill in neya since 2003,neutral
we are delighted to announce our support for intel based handheld platforms the capabilities of which have made our development easier and faster,positive
shares of nokia corp rose thursday after the cell phone maker said its third quarter earnings almost doubled and its share of the global handset market increased,positive
finnish forest machinery manufacturer ponsse has issued a profit warning,negative
if needed she provides also further information on ferry connections and hotels,neutral
the project will be a 2 x 600 mw coal fired power plant located some 420 km south of hanoi the company said,neutral
ebit totalled eur 14 4 mn compared to a loss of eur 0 3 mn in the corresponding period in 2009,positive
amanda capital has investments in 22 private equity funds and in over 200 unquoted companies mainly in europe,neutral
the net sales of healthcare trade business in 2009 were eur 145 1 million eur 155 2 million and operating profit eur 8 9 million eur 7 9 million,neutral
the company will use the assets for strengthening its balance sheet and financial position,positive
mformation and nokia noted they have established interoperability agreements that cover commercially proven standards based management of mobile devices as well as mobile device security and mobile application management,positive
the lemminkainen group headquartered in helsinki finland operates in all sectors of the construction industry : civil engineering building contracting technical building services and the building materials industry,neutral
barclays plc lse : barc nyse : bcs credit agricole sa epa : aca cagr,neutral
the companies signed the letter of intent for the sale on 17 september 2010 and envisaged to seal the actual agreement on 1 january 2011,neutral
the company distributes hiab s products as well as other products,neutral
the met is located in the central business district cbd of bangkok,neutral
this is a much better process than using virgin paper as it requires less transportation of wood pulp from places like finland and canada,positive
lee & man paper and metso have a long and prosperous co operation a good example of which are the changshu and hongmei kraftliner machines delivered earlier,positive
under a preliminary estimation the technology park will measure about 50 000 square meters,neutral
aktia forecasts finland s inflation at 1 1 in 2010,neutral
stora enso norske skog m real upm kymmene credit suisse first boston cfsb raised the fair value for shares in four of the largest nordic forestry groups,positive
sales are expected to increase in the end of the year 2006 however,positive
net income from life insurance doubled to eur 6 8 mn from eur 3 2 mn and net income from non life insurance rose to eur 5 2 mn from eur 1 5 mn in the corresponding period in 2009,positive
comparable net sales are expected to increase more than 10 in 2008 in line with group target,positive
at 1 33 pm the omx helsinki 25 was 0 30 pct lower at 2 463 67 and the omx helsinki was down 0 37 pct at 8 537 42 on volume of 256 mln eur,negative
the new factory working model and reorganisations would decrease nokian tyres costs in the factory by eur 30 million usd 38 7 m,positive
according to gran the company has no plans to move all production to russia although that is where the company is growing,neutral
it wo n t happen overnight,neutral
alexandria va july 11 hannu kahonen of juuka finland has developed an ornamental design for a handle for fire pit door the u s patent & trademark office announced,neutral
the new majority owners of aspocomp thailand co ltd are certain private persons belonging to immediate circle of aspocomp s present joint venture partner saha pathana inter holding plc,neutral
like all other mechanical pipettors from biohit also proline plus is ce ivd marked and comes with a 3 year warranty,neutral
nokia the world s largest mobile phone manufacturer and china postel china s largest mobile phone distributor have a long standing partnership that continues to grow stronger over time,positive
protalix is developing genetically engineered proteins from plant cells,neutral
in the reporting period eps stood at eur0 07 versus eur0 11,negative
the issuer is solely responsible for the content of this announcement,neutral
mn and pretax profit to eur 46 4 mn from eur 35 8 mn in the third quarter of 2006,positive
elcoteq dongguan was established in 1999 in the nancheng district of dongguan china and is one of elcoteq s four volume manufacturing plants in the asia pacific region,neutral
finnish technology company raute corporation omx helsinki : rutav issued on tuesday 23 september a profit warning for the financial year 2008,negative
alexandria va march 20 patrik flykt and timo alakoski both of helsinki finland and tapio suihko and nadarajah asokan both of espoo finland have developed a method of mobility support of internet type protocol traffic in a communication system,neutral
finnish bank of +àland will launch its long term pension savings account at the beginning of june 2010,neutral
the total number of shares in the company will be 585 236 987 innofactor group innofactor offers its customers comprehensive solutions in the microsoft environment,neutral
adp news feb 25 2009 finnish printed circuit board pcb maker aspocomp group oyj hel : acg1v said today it swung to a net profit of eur 300 000 usd 385 000 for 2008 versus a net loss of eur 65 3 million,positive
the developers of that project predict that once it is completed in april 2009 skanssi will attract some 4 5 million visitors annually,positive
the competition was received with great enthusiasm by the employees he goes on,positive
please inform ir johanna koskinen of your participation no later than 20 april at 10 a m a telephone conference for financial analysts and investors conducted in english will begin at 3:00 p m finnish time eet,neutral
the new organization consists of two business units : charging & messaging and finance & administration,neutral
the duration of the lay offs per employee will vary from one to six weeks,neutral
the compnay also said that it would lower the price of development projects by about one third compared with last november,neutral
it is part of the development of the world class magnetite deposit at karara which has the known potential for over 30 million metric tons of annual processing of magnetite over its estimated 30 year life,neutral
one price category is for calls on the preferred operator s network and another for calls on other operators networks,neutral
trading code : eli1v number of shares : 99 483 price share : gratuitous after the transfer elisa holds a total of 10 435 023 own shares,neutral
net sales of the lehdentekijat unit was approximately eur 14 million in 2007 and it had 70 employees,neutral
the company will make its marketing and sales investments initiated in 2009 even more efficient in 2010,positive
yara suomi ltd also provides nitrogen chemicals and technical nitrates to various sectors of industry as well as products used in environmental protection,neutral
the total value of the project is about eur53m including the plots that will be transferred to atria,neutral
a total of 1 800 000 stock options were issued in the 2003 stock option scheme,neutral
jacobs has been supporting storengy s investment of developing storage sites since 2006 as owner s engineer,neutral
russia is ready to participate in an open tender for lattelecom s privatization,neutral
teleste has some 30 offices worldwide and is listed on the nordic exchange in helsinki,neutral
the company will also be compensated for acting as a reserve batch plant,positive
the stockmann department store will have a total floor space of over 8 000 square metres and stockmann s investment in the project will have a price tag of about eur 12 million,neutral
however the production is almost entirely very labor intensive and based on small investments only,neutral
operating profit totalled eur 0 4 mn up from an operating loss of eur 0 8 mn year on year,positive
by cutting the number of plants the group will trim fixed costs,positive
the exercise price of the option will be based on safran software solutions license and maintenance sales as well as the result of the company,neutral
the russian gas giant invested another 46 million litas in the company in late 2004 and now owns 99 5 percent of its stock capital which amounts to 86 936 million litas,neutral
this includes a eur 39 5 mn change in the fair value of investment properties,neutral
wellness services will be important in the future,neutral
ge is building the facility with wind power developer invenergy wind llc,neutral
the talks are aimed at restructuring operations and cutting costs,positive
operating income rose to eur 696 4 mn from eur 600 3 mn in 2009,positive
while i cant understand what theyre saying its impressive to watch him hit that ball at those speeds,neutral
finnish konecranes is again trying to acquire italian fantuzzi a manufacturer of gantry cranes and reach stackers,neutral
lean system supports change management and component purchasing extremely well,positive
the financial impact is estimated to be some 1 5 meur annual improvement in the division s result starting from fiscal year 2007,positive
scanfil holdings include 100 of contract electronics manufacturer scanfil ems group,neutral
residents access to the block is planned to be from aleksandri street,neutral
raisio is the site of the main production plants as well as company headquarters,neutral
yvonne jones is owner of chameleon interiors,neutral
as a domestic business best in is already close to finnish dog owners,positive
provides summary of the medical equipment pipeline products that the company is developing,neutral
about elcoteq elcoteq se is a leading electronics manufacturing services ems company in the communications technology field,positive
today the orange scissors are the iconic symbol of the excellent ergonomic design and superior quality associated with every product from fiskars,neutral
operating loss amounted to eur 0 9 mn in the first half of 2006 compared to a profit of eur 0 5 mn in the first half of 2005,negative
the company offers payroll services including payroll processing payroll tax administration and employee pay services including direct deposit check signing and readychex,neutral
in ukraine too we act as a partner for major bakery clients in both production and product development,neutral
net sales increased to eur193 3 m from eur179 9 m and pretax profit rose by 34 2 to eur43 1 m eur1 usd1 4,positive
then it said the contract was estimated to contribute more than eur150m to its net sales in 2010,positive
besides as there is no depositor preference in finland senior debt and deposits rank on a par which is also taken into consideration the agency added,neutral
in the next few years the ict sector s share of electricity consumption will be raised by the increase in the popularity of smartphones,neutral
a plumbing business has announced it is sponsoring a professional darts player,neutral
the concept enables a commercially affordable way to manufacture high quality tco coated glass for the solar industry,positive
inge larsen cfo 29 045 shares representing 0 50 of the share capital,neutral
finnish media company talentum oyj s net profit decreased to 2 5 mln euro $ 4 0 mln for the first quarter of 2008 from 3 0 mln euro $ 4 7 mln for the same period of 2007,negative
in a letter to economic affairs minister the listed estonian shipping company tallink asks for the approval to be entitled to a 15 cut in port fees in 2010,neutral
it expects revenue between $ 8 4 billion and $ 8 7 billion compared to analyst estimates of $ 8 67 billion,neutral
these new units will be built at cargotec s state of the art manufacturing facility in san antonio texas usa which started operations in 2009,neutral
asian traffic declined by 3 4 per cent,negative
chief executive officer olli pekka kallasvuo s changes on tuesday mark the third time in nine months the company has reshuffled executives and operations as nokia loses ground to apple s iphone and rim s blackberry,negative
unilever s turun sinappi that is made in sweden holds 40 of the market,neutral
the employee negotiations are to address measures needed to adjust the operations to the present production situation,neutral
net sales in 2006 totaled eur 302 million and the operating margin was 16,neutral
by implementing the software the finnish army aims to unify and improve its operations in these application areas qpr software stated,positive
elcoteq has a proven track record in electronics manufacturing services ems and a global factory network coupled with modern manufacturing equipment and consistent systems and processes,positive
the newly created position has been established to strengthen amer sports management in strategic planning and execution,positive
efore has decided to establish a company for eletric vehicle ev business in china,neutral
the desk will reach its full planned strength of ten persons in autumn 2007,neutral
amer which bought salomon from adidas in october said the job cuts are aimed at boosting competitiveness,neutral
facades in riga 8 march 2010 finnish construction company yit oyj hel : yty1v said today that it will build the frame and the facades in a tower construction project in riga,neutral
the company is involved in the the sale of financial products including insurance mortgages car and personal loans financial brokerage and equipment finance leasing,neutral
one of the headboxes will be equipped with a modern consistency control system to ensure cross machine profile of the plasterboard,neutral
castecka said the town hall would hold talks with other investors interested in the zone,neutral
nordea s definitely too big for sampo to acquire said an analyst but sampo would appear to have an agenda for nordea ahead of the privatisation,neutral
it posted a turnover of 4 5 mln euro $ 6 1 mln and an operating profit of 1 5 mln euro $ 2 0 mln for 2006,neutral
however the bottom line result improved thanks to positive financial items,positive
dmasia 16 august 2006 benefon extends manufacturing capability with asmobile ® 2006 digitalmediaasia com & dma ltd,positive
the output of the contracts totals 72 mwe,neutral
the potential acquirer is cencorp corporation which is a related entity to sav owing to each of sav and cencorp being a subsidiary of the finnish savcor group oy,neutral
the company also said that it will sell approximately 150 hectares of land to the city of valkeakoski by the end of the year a part of its from job to job program,neutral
management decided at the end of 2005 to increase cathode copper capacity,neutral
unit prices for straddle carriers vary between eur700 000 and eur900 000 the company added,neutral
the payment of 2 779 million litas in interest on a long term loan provided by ragutis majority shareholder estonia s a le coq also added to the losses,negative
decisions are to be made as quickly as possible,neutral
operating loss totalled eur 0 3 mn down from a profit of eur 5 1 mn in the first half of 2009,negative
the first group of customers to be trained will be paint shop owners and their assistants,neutral
the measures taken will cause one time costs during the final part of 2006,neutral
the air traffic of finland has been in stoppage since then,negative
the approximately 20 000 dwt vessel has been ordered from india,neutral
furthermore the company will sell the warehouse and office buildings in loudeac and saint marcel and lease new joint premises for these operations in morvillars,neutral
the floor area of the yliopistonrinne project will be 7 900 sq m 85 030 sq ft and the building s gross area will total 12 800 sq m a total 25 1 of the facilities have been let,neutral
the marubeni group focuses on creating value chain from upstream to downstream encompassing a wide variety of business fields including oil & gas metals mineral resources foods pulp & paper and chemicals among others,neutral
adp news nov 13 2008 finnish printed circuit board pcb maker aspocomp group oyj omx : acg1v said today that its net loss narrowed to eur 2 million usd 2 5 m in the first nine months of 2008 from eur 57,positive
viking line head jan kaarstroem told tt that his company s ferries were well equipped to handle ice and that all the passengers were safe,positive
the first four of the new shop in shops will be opened this spring : on madison avenue in new york as well as in chicago los angeles and san francisco,neutral
the finnish company previously said its operating result will be lower than the break even posted a year earlier,negative
patrick jeambar will also continue being responsible for innovation and health safety and environment hsea functions of ahlstrom corporation,neutral
the objective is that trading in the shares will commence on may 2 2007,neutral
finnish consumers prefer to buy the cheapest beer brand,neutral
the operations to be sold include manufacturing units in finland france poland and turkey as well as sales units in germany and lithuania,neutral
protalix closed at $ 10 71 on friday on the american stock exchange giving a market cap of $ 827 million,neutral
25 march 2011 finnish electronics contract manufacturer scanfil oyj hel : scf1v said today its plan to merge wholly owned scanfil ems group with ojala yhtyma oy has hit a snag as shareholders of the domestic rival rejected the deal,negative
the growth of net sales has continued favourably in the middle east and africaand in asia pacific,positive
the hayward calif based target designs active casual and dress footwear as well as boots and sandals,neutral
the situation of coated magazine printing paper will continue to be weak,negative
in the third quarter of 2010 net sales increased by 5 2 to eur 205 5 mn and operating profit by 34 9 to eur 23 5 mn,positive
in january september 2009 the group s net interest income increased to eur 112 4 mn from eur 74 3 mn in january september 2008,positive
nokia messaging 1 1 enables customers to receive e mails from up to 10 e mail accounts on their mobile phone supporting all pop or imap e mail services,neutral
prior to the transaction whose financial terms have not been disclosed alma media owned 40 of kotikokki net,neutral
tieto offers aktia a good foundation and the required support services for implementing the update project says juha volotinen responsible for aktia s web services,positive
all amer sports companies develop and manufacture technically advanced products that improve the performance of active sports participants,neutral
the corresponding increase in the share capital in total eur 300 00 was registered in the finnish trade register on may 8 2008,neutral
in august october 2010 the company s result before taxes totalled eur 9 6 mn up from eur 0 5 mn in the corresponding period in 2009,positive
it is necessary to strengthen the company s operations however,neutral
circulation revenue has increased by 5 in finland and 4 in sweden in 2008,positive
seller is the finnish elcoteq group the largest european electronics manufacturing services company,neutral
the recruits who have completed the k retailer trainee program are qualified to start a career as independent retailers in k stores,neutral
increase in the number of shares is based on the option rights which were granted to the management of the company under the stock option plan 2006,neutral
m+ñkel+ñ is demanding a new board for the company as well as discussions on the merger of alma media and media company talentum,neutral
ahlstrom corporation anne pirila director financial communications distribution : helsinki stock exchange main media ahlstrom in brief ahlstrom is a leader in the development manufacture and marketing of high performance fiber based materials,neutral
it allows the young child to move forward with his life,positive
in addition to the demand in finland the export of lining stone products also increased,positive
basware s product sales grew strongly in the financial period by 24 percent,positive
nordstjernan has used its option to buy another 22 4 stake of salcomp s shares and votes,neutral
the contracts comprise turnkey orders for roro systems for two roro cruise vessels under construction for viking line and tallink,neutral
comparable operating profit totaled eur 4 7 mn down from eur 5 1 mn in the corresponding period in 2005 representing 7 4 of net sales,negative
in addition the existing service counter area in the reception hall will be rebuilt and access provided to local rail connections,neutral
according to viking line s managing director nils erik eklund the company s board of directors is very satisfied with viking line s performance,positive
the company s consolidated operating profit amounted to eur 15 86 mn up from eur 4 14 mn year on year,positive
yit corporation sept 24 2007 at 13:30 corporate release stock exchange release yit s capital markets day in london sept 26 2007 on wednesday september 26 2007 yit will hold a capital markets day for investors and analysts in london,neutral
poyry has a good track record of major transportation projects in latin america,positive
aspo serves demanding business to business customers,neutral
the major breweries increased their domestic beer sales by 4 5 per cent last year to 256 88 million litres from 245 92 million litres in 2004,positive
we are pleased to invite you to join m real s international conference call at 3:00 p m eet,neutral
adpnews jun 30 2009 finnish stainless steel maker outokumpu oyj hel : out1v said yesterday it signed a three year eur 900 million usd 1 3 bn revolving credit facility,positive
4 february 2011 finnish privacy and security software developer tectia oyj hel : tec1v said wednesday it has set up two strategic business units managed security and mobile authentication,neutral
operating profit rose to eur 9 2 mn from eur 6 8 mn in the corresponding period in 2007,positive
stora enso s business in north america has annual capacity of about 3 million tons and employs about 4 350 people,neutral
demand for sports equipment was good in 2005,positive
m real said there are no grounds for the rumors which have been circulating in the market for some months,neutral
he said he has been losing five families a month to the economy as many make alternative arrangements to save money,negative
operating profit rose to eur 5mn from eur 2 8 mn in the fourth quarter of 2008,positive
feed companies suomen rehu and raisio do no import gmo feed,neutral
it started with software that was capable of retrieving the data typed into the computer keyboard keyloggers and then more complex mechanisms arrived on the scene such as phishing and pharming,neutral
frost sold shares for $ 19 million at $ 6 06 7 12 per share compared with friday s high of $ 11 33 and low of $ 10 14,negative
the money will be spread mainly over 2011 and 2012 the company said,neutral
the board of directors was authorized to decide on other terms of the share issue,neutral
after the renovation the biggest moulding line in the orhangazi foundry is the most modern line in europe,positive
following the increase huhtamaki oyj s registered share capital is eur 358 706 290 00 and the number of shares outstanding is 105 501 850,neutral
operating profit in the fourth quarter went down to eur3m from eur4 2 m for the corresponding period of 2009 as it included costs of growth projects,negative
rapala vmc corporation rapala a leading fishing tackle and sporting goods manufacturer and distributor is the main owner of peltonen with its 80 shareholding,neutral
operating loss totalled eur 4 0 mn compared to a profit of eur 8 6 mn in the second quarter of 2008,negative
the main strength of the cooperation project lies in merging the know how of two large companies,positive
professional and consumer applications include personal navigation personal safety field and workflow management and asset tracking,neutral
the total investment in 2006 and 2007 is expected to amount to about eur75m,neutral
