headline,label
dixons carphone profit boost on strong sales,positive
intercontinental hotels first quarter global room revenue lags estimates,negative
philip morris bat sue over law taking branding off packs,negative
shire sees baxalta deal closing as expected after new rules,positive
warren buffett defends berkshire hathaway s conglomerate structure,positive
rbs will reportedly appoint howard davies as its next chairman,positive
u s debt lures schroders as ecb depresses rates,positive
astrazeneca and daiichi sankyo to jointly commercialise movantik in the us,positive
diageo sales disappoint as currency and comparatives leave bitter taste,negative
companiescar insurer hastings group driving â£180m ipo,positive
lse deutsche bã¶rse dealmakers wrong to ignore brexit risk,negative
trlpc crh backs lafarge holcim asset buy with 6 5 bln euro bridge loan,positive
bp statoil to withdraw staff from algeria following rocket attack,negative
astrazeneca profit down as sales of stalwarts fade,negative
kinder morgan and bp form joint venture limited liability company to purchase,positive
royal mail chairman donald brydon set to step down,negative
sophos aims to raise $100m in london ipo,positive
astrazeneca suffers setback after drug fails to treat eye cancer,negative
itv share price jumps on report of comcast s nbcuniversal bidding to takeover,positive
whitbread buys 49 stake in pure food chain,positive
ftse rallies off three month low boosted by stanchart sainsbury,positive
tesco share price dips as blinkbox books closes ending supermarket s digital,negative
arm slammed by handset sales outlook,negative
compass group says positive for year ahead,positive
companiesnew aggreko ceo to reshape business strip costs,positive
shell s $70 billion bg deal meets shareholder skepticism,negative
ackman in email says supports valeant ceo pearson,positive
tesco shareholders back itv head for chairman,positive
aviva shuts friends life head office in rapid integration move,negative
persimmon share price climbs on 23 rise in full year revenue,positive
update 5 barclays chairman mcfarlane axes ceo to speed up strategic change,negative
bilfinger industrial services win â£100m bp contract extension,positive
press: serco set to appoint roy gardner ex centrica as chairman ft,positive
bhp billiton slashes dividend posts $5 67 billion net loss,negative
royal mail johnson matthey lead ftse lower,negative
retailers kingfisher and sports direct rise in britain s share index,positive
astrazeneca teams with daiichi sankyo to sell movantik in us,positive
market report: eight day rally ends for ftse 100 and standard chartered,positive
friends life lifts profits 38 and hikes divi ahead of proposed aviva takeover,positive
berkshire applies to boost wells fargo stake above 10 percent,positive
refile hikma and barclays help britain s ftse to climb higher,positive
companies thetrainline com announces arrival of london ipo,positive
tesco sales recover as focus returns to core business,positive
update 1 lloyds to cut 945 jobs as part of 3 year restructuring plan,negative
update 1 sabmiller 2nd quarter underlying sales rise forex impacts margins,positive
goldman sachs barclays hsbc downplay brexit threat,neutral
shire ceo steps up drive to get baxalta board talking,positive
companiestesco off to a bad start over xmas â€ kantar,negative
eu drops shell bp statoil from ethanol benchmark investigation,positive
kraft cadbury s and britvic in total recall: how pulling a product affects profit,negative
wpp boosts sales despite cautious clients,positive
update 1 berkshire applies to boost wells fargo stake above 10 pct,positive
exclusive bp china s cnpc to unveil oil alliance sources,positive
greene king s third quarter sales boosted by festive season,positive
l&g completes uk s largest medically underwritten bulk pension risk deal,positive
industry newsmorrisons unveils which stores will close as 900 jobs face the axe,negative
rpt old mutual q1 gross sales beat forecasts up 18 pct,positive
morrisons and debenhams surprise city with christmas bounce back,positive
bbcn bancorp to buy wilshire bancorp in $1 bln deal,positive
borealis infrastructure putting together new severn trent bid,positive
passengers rise at easyjet and aer lingus,positive
fda approves astrazeneca s iressa as lung cancer treatment,positive
update 1 astrazeneca boosts respiratory unit with $575 mln takeda deal,positive
bhp billiton posts big loss slashes dividend,negative
companieslse adds ex sec head schapiro to board,positive
can christmas save sainsbury s plc and tesco plc,negative
astrazeneca bags another cancer drug deal this time with inovio,positive
update 1 engineering firm smiths group confirms ceo appointment,positive
update 1 meggitt reiterates annual outlook after tough 2014,positive
astrazeneca explores potential deal with acerta for cancer drug,positive
tesco set to sell kipa giraffe businesses sky news,negative
intercontinental hotels group share price climbs on $1 5bn special dividend,positive
glencore cuts 2015 budget plans to divest from lonmin,negative
shire proposes $30 bln all share tie up with baxalta,positive
glencore sees tripoli based noc as sole legal seller of libyan oil,positive
fda approves shire s vyvanse for binge eating disorder,positive
astrazeneca wins fda approval for key new lung cancer pill,positive
crh s concrete bid for holcim lafarge assets,positive
update 3 stifel to buy former lehman brokerage from barclays,positive
britain s ftse falls back with ashtead commodities under pressure,negative
rio tinto swings to loss drops dividend policy,negative
britain s ftse gains land securities up after dividend hike,positive
tesco abandons video streaming ambitions in blinkbox sale,negative
astrazeneca shares climb 3 as drug maker ups profits forecasts,positive
royal mail share price edges lower as group raises stamp price,negative
amazon s grocery deal with morrisons is only the beginning,positive
shell and bg shareholders to vote on deal at end of january,neutral
tesco breaks its downward slide by cutting sales decline in half,positive
royal mail turnaround proving expensive in tough uk market,negative
meggitt share price tumbles as profit falls in challenging year,negative
hsbc hit by fresh details of tax evasion claims,negative
novartis buys remaining rights to gsk treatment in deal up to $1 billion,positive
ab inbev ups offer for sabmiller as deadline looms,positive
easyjet dismisses lufthansa low cost plan in contest for germany,negative
ab inbev attacks sabmiller bid rebuffal,negative
bg group appoints new ceo one month early,positive
royal mail gets mixed bag from ofcom postal regulation report,negative
how kraft heinz merger came together in speedy 10 weeks,positive
arm profits and sales up as shift away from mobile gains pace,positive
tesco sells half of stake in ecommerce site lazada to alibaba for â£90m,negative
rbs chairman admits surprise at size of regulatory penalties,negative
l&g still paying price for dividend cut during crisis chief says,negative
tesco sales rise shows tentative recovery continues,positive
new credit suisse boss faces stiff challenge in asia,negative
sainsbury sales slip again as price pressures take a toll,negative
refile update 4 britain s lloyds to pay first dividend since rescue,positive
update 1 pearson expects to grow this year after solid end to 2014,positive
shell to buy bg group in $69 7 billion takeover,positive
diageo receives reports from united spirits on financial irregularities involving,negative
hsbc shakes up board with two new business chiefs three departures,negative
standard chartered shifts emerging markets strategy after losses,negative
buffett s berkshire builds deere stake dumps exxon,positive
hsbc says unit to book $585 million charge on settlement,negative
auto trader share price surges as company floats on lse,positive
hargreaves lansdown bucks weak markets to see assets rise 2 6 percent,positive
mylan appoints ranjan ray chaudhuri as global commercial lead for mylan s over,neutral
bhp billiton drags ftse lower after slashing dividend,negative
nyse owner ice considers offer for lse,positive
ice said to start lining up financing for lse bidding war,positive
lse gets hong kong regulatory nod to hk firms to become lse members,positive
caixabank dos santos agree on plan for bpi angola exposure,positive
lse deutsche boerse merger would signal end to exchange mega deals,positive
centrica extends gas deals with gazprom statoil,positive
easyjet expects resilient demand to withstand security fears,positive
standard chartered s shares plunge 7 after fitch downgrade,negative
news feedschroders books solid earnings growth several board changes,positive
insurers: admiral blows hot and cold but aviva soars pre friends life merger,positive
peroni and grolsch put up for sale as ab inbev plans acquisition of sabmiller,positive
ab inbev looks to win over sabmiller investors,positive
aviva friends life top forecasts ahead of 5 6 billion pound merger,positive
horizonte acquires neighbouring glencore nickel property in brazil,positive
shire says internal synergy goals from baxalta deal higher,positive
brief legal & general s retirement business books 4 billion stg h1 sales,positive
update 1 nomura rbs must pay $806 mln in mortgage bond case us judge,negative
astrazeneca diabetes drug combination faces delay after fda rebuff,negative
stakes high for astrazeneca heart drug facing tough competition,negative
tesco share price jumps as q3 sales top estimates,positive
breakingviews: iag can pay more for aer lingus,positive
wpp wins race for programmatic buying agency essence digital,positive
tesco closes in on new chairman with dixons carphone s john allan in the frame,positive
marketsshire up 2 5 and baxalta up 6 on $32bn deal,positive
shares in bae systems hit 10 month high on rating upgrade,positive
glaxosmithkline targets growth across units scraps viiv ipo,positive
buffett s company reports 37 percent drop in 2q earnings,negative
bunzl lifts dividend again as acquisitions continue to boost profits,positive
update 1 bhp billiton s credit ratings fragile in fy16 agencies warn,negative
ab inbev to sell more sab assets as seeks eu deal approval,negative
spain s caixabank expects to close deal for banco bpi,positive
whitbread boss andy harrison defends sales fall as just a blip,negative
broker tips: rbs croda sage,positive
supreme court upholds $236 million jury award against exxonmobil,negative
petrofac books further â£30m cost for shetland gas terminal delays,negative
shire share price under pressure after $32bn baxalta deal,negative
should you buy jumbo yielders british american tobacco plc centrica plc & john wood group plc,positive
dbs julius baer emerge as potential bidders for barclays asia wealth unit,positive
british american tobacco drops and sues pwc over pollution scandal,negative
nine banks including barclays citi agree to pay $2 billion to settle forex,negative
ab inbev offers sabmiller $3 billion breakup fee,positive
britain s ftse outperforms europe royal mail and tesco rise,positive
industry newswolseley confident in reslilience amid mixed markets,positive
japan s nikkei lands financial times in $1 3 billion deal,positive
standard chartered lags on capital worries,negative
update 3 auto trader shares leap in uk s biggest private equity backed listing,positive
aberdeen asset management gains foothold in china,positive
bae systems s sales boosted by european typhoon and currencies,positive
kingfisher share price slides on cost to implement new strategy,negative
ftse 100 flat; standard chartered leads risers,positive
merged lse and deutsche bã¶rse would be led by germany s kengeter,positive
irish said chasing standard chartered rbs as brexit vote nears,positive
standard chartered not raising capital yet as dividend cut,negative
brewer ab inbev seeks $275 bln tie up with sabmiller,positive
severn trent share price jumps as canadian investor renews pursuit of utility,positive
slump in weir leads ftse down from record high,negative
ab inbev s latest bid said unlikely to win sabmiller s approval,positive
are aviva plc direct line insurance group plc and admiral group plc set to soar,positive
diageo sells ryder cup venue gleneagles hotel to ennismore group,positive
the coca cola company and coca cola femsa to acquire ades soy based beverage business from unilever,positive
ftse led lower by m&s glaxosmithkline,negative
uk housing market steadies after brexit dip persimmon says,positive
tesco share price closes higher as two more directors leave grocer,positive
aldi and lidl expansion plans speed ahead as tesco sainsbury s morrisons,positive
london morning briefing: hsbc and standard chartered shares rise,positive
companiesdixons carphone to close 134 uk stores as sales jump,positive
rbi surprises street; sensex pares gains after hitting mount 30k,negative
aviva fined $27 million by u k regulator over fee failings,negative
whitbread share price climbs on q4 sales growth,positive
rbs pays $1 7 billion to scrap u k treasury s dividend rights,positive
diageo shares surge on report of possible takeover by lemann,positive
update 5 sabmiller rejects ab inbev s $104 bln takeover approach,positive
lloyds to cut 945 jobs as part of three year restructuring strategy,negative
companiesdiageo stays neutral on india boardroom turmoil,neutral
legal & general share price: finance chief to step down,negative
glencore slumps 25 pct as debt fears grow,negative
shell challenges exxon dominance with 47 billion pound bid for bg,negative
glencore fight back over debt fears lifts shares,positive
citigroup to sell onemain to springleaf for $4 25 billion,positive
sab s chairman digs in with board divided on inbev offer,positive
update 3 bp settles oil spill related claims with halliburton transocean,negative
are arm holdings plc domino s pizza group plc and asos plc 3 must have growth stocks,neutral
companiesfresnillo shares jump 8 as silver price breaks $21,positive
tesco plc s recovery continues with a â£250m cash infusion,positive
companiesunilever sales lifted by ice cream in soft economy,positive
update: easyjet passenger numbers aer lingus traffic up in february,positive
ocbc to buy barclay s wealth management unit in singapore hong kong,positive
relief for lewis as tesco sees sales grow for first time in a year,positive
oil majors like royal dutch shell chevron bp fail to find reserves to counter,negative
gkn to buy fokker technologies for 706 mln euros,positive
astrazeneca s patent on asthma drug invalidated by us court,negative
carnival corporation and china merchants group sign memo of understanding,positive
ingenious hsbc ubs and coutts sued by tax avoidance clients,negative
valeant said to name new ceo with pearson still hospitalized,positive
update: barclays expects gain after settling with lehman bros trustee,positive
kingfisher takeover of mr bricolage could hit a brick wall,negative
astrazeneca sells us drug rights to perrigo for $380 mln,positive
nyse owner ice may gatecrash deutsche boerse lse merger,negative
g4s sees profits rise but uk contract problems remain,positive
japan s asahi to submit bid next week for sabmiller s grolsch and peroni yomiuri,positive
itv to pursue takeover of canada s entertainment one: bloomberg,positive
glaxosmithkline set to complete $20 billion novartis asset swap next week,positive
news feedftse 100 movers: ashtead jumps on strong interims; glencore bp in,positive
shell share price: standard life announce position against bg acquisition,negative
johnson matthey share price slumps as company posts full year results,negative
royal mail share price rallies amid positive broker comments,positive
credit suisse poaches prudential s thiam for asian push,positive
reed elsevier share price slides on underwhelming full year results,negative
conagra names former hillshire farms ceo connolly to top post,positive
johnson matthey revs up on clean air drive,positive
teva: fda approves generic version of astrazeneca heartburn drug,positive
retail giant kingfisher reports solid start to the year,positive
fda approves nps drug in move validating shire takeover deal,positive
sainsbury cfo rogers to replace home retail ceo walden,neutral
doubts grow over glaxosmithkline s $6 bln capital return plan,negative
bhp billiton share price: brazil to sue samarco for â£3 5bn,negative
miners meltdown as bhp to rio tinto sink in commodities rout,negative
ge to sell majority stake in bank bph s core bank to alior bank,positive
barclays share price subdued as bank faces fresh forex probe,negative
britain s ftse bounces back mondi and barratt lead,positive
goodwin not to face scottish prosecution over rbs,positive
imperial tobacco adds quarterly dividends after profit rose,positive
talktalk hires bae systems to investigate cyber attack,negative
morning agenda: shire s deal for nps,positive
london open: taylor wimpey and ashtead drive markets higher barclays falls,positive
petrofac share price rises despite â£30m costs on north sea project,positive
builder persimmon hails 6 rise in house sales,positive
sainsbury sells unit to lloydspharmacy,positive
britain s ftse forges ahead as shire surges,positive
berkshire discloses unit s ties to iran opens probe,negative
sabmiller buys meantime to quench thirst for craft beer,positive
why i d buy arm holdings plc and bhp billiton plc today,positive
london stock exchange shareholders approve merger with deutsche bã¶rse,positive
barclays poaches new chief operating officer paul compton from jp morgan chase,negative
uk s ftse has worst day so far in 2015 as bg and prudential fall,negative
companieshome retail trims gains but is considered in play,positive
is trouble brewing at legal & general group plc and aviva plc,negative
hammerson jv partner secure ownership of ireland s dundrum quick facts,positive
companieshoward davies appointment as rbs director delayed,negative
royal mail breached competition law over delivery service changes ofcom claims,negative
keith skeoch to step up as david nish quits as chief executive of standard life,negative
ocwen reaches settlement with california regulator,positive
should you buy associated british foods plc great portland estates plc and dunelm group plc following today s news,positive
new morrisons duo get former boss s support to diffuse investor tension,positive
standard life share price: insurer buys advice firm pearson jones,positive
companiesab inbev signals it won t go hostile for sabmiller,positive
update 3 ex barclays director accused by us of illegal tips to plumber,negative
ceos of bpm ubi meet italy econ minister as m&a talk heats up,positive
fda approves astrazeneca drug for advanced lung cancer,positive
france raises concerns over proposed lse deutsche boerse deal,negative
royal dutch shell to buy bg group for nearly $70 billion,positive
copper market may get a 2003 style supply shock from glencore closures,negative
randgold profit hit by poor gold price but dividend still increases,negative
g4s slides on balance sheet worries,negative
glencore studies possible ipo for agricultural trading business,positive
chime communications set to be acquired by wpp and providence,positive
tata steel working with stanchart for uk unit sale source,positive
astrazeneca share price: acerta deal pays off with orphan drug status,positive
aviva promises higher dividends to boost flagging share price,positive
gsk joins china trade push as uk trumpets healthcare deals,positive
britain s ftse gets lift from prudential results,positive
verizon and at&t accused of hurting rivals,negative
london stock exchange seals â£22 billion merger with germany s deutsche bã¶rse,positive
us dollar wipes out sales gains for sabmiller,negative
sainsbury s asda tesco and morrisons will all cut petrol prices as oil falls,negative
severn trent share price rises as first half profit inches up as customer,positive
tesco share price steady as analysts weigh in on results,positive
astrazeneca s lung cancer drug tagrisso gets fda approval,positive
insurer old mutual picks standard bank s hemphill as new ceo,positive
why astrazeneca plc & dixons carphone plc are red hot growth stars,positive
whitbread profit up as sales continue to rise looking for new ceo,positive
millercoors board names gavin hattersley interim ceo,neutral
s&p downgrades barclays and rbs on government bailout fears,negative
tesco leads leap in ftse 100; marks & spencer drops,positive
old mutual first quarter sales up 18 buoyed by emerging markets,positive
update 1 dairy crest loses a third of morrisons milk contract,negative
glencore slumps 30 percent as debt fears grow,negative
glaxo s viiv healthcare signs china manufacturing deal with desano,positive
shell offers 50 percent premium to buy bg for $70 billion,positive
ab inbev to sell sabmiller stake in china s snow beer,negative
irish housebuilder cairn homes plans london listing,positive
bpi says caixabank isabel dos santos reach agreement over angola exposure,positive
stanchart and rbs struggle in bank of england stress tests,negative
glencore chief blames rivals overproduction for share price fall,negative
aviva weighs cash handout after beating profit forecast,positive
balfour beatty plc set to reinstate dividend and rival national grid plc and centrica plc once more,positive
saudi aramco shell plan to break up motiva divide up assets,negative
drugmaker shire to buy baxalta for $32 billion after 6 month pursuit,positive
intertek group announces strategic update outlining its plan,positive
johnson matthey profit falls but dividend rises,neutral
travis perkins hikes dividend 20 as profit and revenue rise,positive
morrisons finance chief to fill gap as ceo leaves early,negative
intertek swings to â£347 mln loss on oil s slump,negative
analyst views: astrazeneca shares have seen recent volatility; what will 2015,negative
update 2 pricey beers lift sabmiller s quarterly underlying sales,positive
australia clears ab inbev s $100 billion sabmiller buyout plan,positive
wpp world s largest ad agency reports strong 2015 growth,positive
glencore blames rivals for creating metals glut,negative
intercontinental hotels denies reports of starwood merger talks,negative
tesco criticised for disgraceful advert showing domestic worker being slapped,negative
fda panel backs safety updates for astrazeneca takeda drugs,positive
hargreaves lansdown share price falls as costs mount although pensions,negative
tesco asda sales fall as march of the discounters continues kantar,negative
despite sales growth uk s tesco cautions recovery to be bumpy,negative
should you follow berkshire hathaway into apple stock,neutral
sales boost for new morrisons chief david potts as tesco turnaround stalls,negative
do it for me trend underpins uk sales growth at kingfisher,positive
valeant names interim leader as ceo remains hospitalized,neutral
astrazeneca to buy zs pharma for $2 7 billion,positive
barclays bonds rise as lender cuts dividends to shore up capital,positive
amazon to attack uk grocery market with morrisons deal,positive
morrisons book second consecutive quarter of sales growth,positive
entertainment one dispels itv takeover rumours,positive
crown castle buys tower development corp for $461 million,positive
renewed ab inbev bid for sabmiller ups stake in beer battle,positive
ftse edges up as investors cheer kingfisher results,positive
tesco shares jump 6 after christmas sales beat expectations,positive
berkshire hathaway names kara raiguel to lead general re unit,positive
eu regulators clear $100 billion plus ab inbev sabmiller deal,positive
asahi could be about to snap up more of sabmiller s beers ahead of ab inbev sale,positive
tullow oil suspends dividend amid oil price fall,negative
tesco s sales pickup isn t enough,negative
tesco share price down as grocer faces sfo investigation outcome,negative
aberdeen am posts h1 outflows says conditions to remain challenging,negative
crh adds cr laurence to acquisitions tally for $1 3bn,positive
market report: aviva tops the market as traders approve of its choice of friends,positive
barclays appoints jpmorgan s paul compton as new coo,positive
rolls royce to ensure compliance after petrobras bribery report,negative
refile aviva investors to move 34 bln euros in assets from axa fund arm,negative
investors remain skeptical about shell bg deal,negative
companieskingfisher bid for mr bricolage runs into trouble,negative
aspen to buy anaesthetics from astrazeneca for $520 million,positive
