headline,label
glaxo sees hope for respiratory drugs as earnings beat estimates,positive
genel shares plunge after tony hayward s oil explorer cuts crude reserves at core field,negative
stanchart may see white knight takeover on painful recovery clsa,negative
bp ends 27 year sponsorship of tate as falling oil price takes toll,negative
randgold resources third quarter profit slips despite record production,negative
aviva friends life top forecasts ahead of 5 6 billion pound merger,positive
companies severn trent expects costs hit from inflation,negative
uk christmas power demand to be lowest in 16 years â€ national grid,negative
berkshire discloses unit s ties to iran opens probe,negative
new bg group ceo helge lund starts earlier than expected,positive
lse deutsche boerse merger would signal end to exchange mega deals,positive
aviva promises higher dividends to boost flagging share price,positive
fda approves nps drug in move validating shire takeover deal,positive
priceline s stock jumps to new high for the year after barclays upgrade,positive
tesco sales recover as focus returns to core business,positive
companiesphilips transfers $900m of pension obligations,positive
investor woodford calls for outsider to head glaxosmithkline,positive
british american tobacco says would fight uk plain packaging law,negative
balfour beatty plc set to reinstate dividend and rival national grid plc and centrica plc once more,positive
old mutual first quarter sales up 18 buoyed by emerging markets,positive
standard chartered not raising capital yet as dividend cut,negative
astrazeneca diabetes drug combination faces delay after fda rebuff,negative
ex barclays traders sentenced to up to six years jail in libor case,negative
astrazeneca chases acerta to secure next cancer drug winner,positive
aberdeen s shares slide as net outflows accelerate,negative
update 1 eu regulator backs approval for gsk injectable asthma drug,positive
royal mail share price edges lower as group raises stamp price,negative
shire to buy nps for $5 2 billion to boost rare disease drugs,positive
the coca cola company and coca cola femsa to acquire ades soy based beverage business from unilever,positive
wolseley helps lift ftse from losses,positive
sports direct boss mike ashley summoned to westminster for questioning over the treatment of workers,negative
intercontinental hotels first quarter global room revenue lags estimates,negative
update 1 pearson expects to grow this year after solid end to 2014,positive
companiescar insurer hastings group driving â£180m ipo,positive
valeant said to name new ceo with pearson still hospitalized,positive
whitbread eyes savings price rises to offset wage rises,positive
shell fined by scottish court for 2011 north sea oil spill,negative
ftse ends higher; 3i group leads after strong earnings,positive
tesco share price: brand guarantee comes under fire,negative
severn trent profit up as customer complaints fall,positive
barclays in $13 75 million us settlement over mutual funds,negative
ftse steadies around 2 month low diageo shares surge,positive
wpp q1 revenue rises over 8 quick facts,positive
morrisons share price: group trading director departs as management cull,negative
aviva m&g suspend property funds as investors panic,negative
tesco s boss knows which side his bread is buttered,positive
rbs warns of higher misconduct charges obstacles ahead,negative
shire in talks with baxalta shareholders,positive
eu drops shell bp statoil from ethanol benchmark investigation,positive
morrisons escapes ftse relegation,positive
brazil vale says will appeal ruling to block assets for dam burst,negative
persimmon revenues lifted 12 by post election confidence,positive
jc penney cuts pension plan obligation,positive
landlord hammerson s nav rises on increased leasing activity,positive
lloyds wins right to buy bonds back early to save 1 billion pounds,positive
standard chartered s shares plunge 7 after fitch downgrade,negative
lloyds banking group s share price lifts amid reports bank is poised to axe hundreds of uk jobs,positive
land securities warns of rent rises,negative
worldpay readies for â£6bn london float,positive
bp cuts capex for third time this year to deal with weak oil,negative
ftse rallies off three month low boosted by stanchart sainsbury,positive
lse deutsche bã¶rse dealmakers wrong to ignore brexit risk,negative
companiescoutts raids jpmorgan chase for new ceo,negative
glencore agrees to sell minority stake in agriculture business,positive
update 1 rio tinto to sell aluminium assets in $1 bln deal paper,positive
valeant names interim leader as ceo remains hospitalized,neutral
global markets stocks gain on royal dutch shell bid oil slumps,positive
rbs and barclays shares temporarily suspended amid heavily losses,negative
brief aviva aims to increase dividend pay out ratio to 50 pct in 2017,positive
british american tobacco accused of bribing senior politicians to sabotage,negative
primark racks up a happy christmas after strong sales,positive
legal & general share price: finance chief to step down,negative
us seeks huawei records on dealings with sanctioned nations,negative
bp pay boss feels the heat from revolt over dudley s â£14 million,negative
companiesnational grid lines up sale of gas business,positive
standard chartered rbs escape capital raising in stress test,positive
companiesastrazeneca wins nod for blockbuster hopeful,positive
bp signs $12 billion energy deal in egypt,positive
companiesdiageo moves cfo to lead north american business,neutral
new morrisons duo get former boss s support to diffuse investor tension,positive
rolls royce to ensure compliance after petrobras bribery report,negative
aldi and lidl expansion plans speed ahead as tesco sainsbury s morrisons,positive
persimmon shares nudge higher as housebuilder sees strong 2014,positive
morrisons store closures: 900 jobs to go as 11 branches are closed due to,negative
astrazeneca teams with daiichi sankyo to sell movantik in us,positive
standard chartered ceo peter sands to resign after unrest at bank,negative
direct line rings up higher profit,positive
sainsbury chief warns of squeeze on high street retailers,negative
valeant ceo pledges to heed critics after painful experience,negative
update 3 bp settles oil spill related claims with halliburton transocean,negative
diageo heineken exchange emerging market brewing assets,positive
dixons carphone profit boost on strong sales,positive
shell seeks to remove greenpeace activists from oil rig,negative
ab inbev holds talks with regulators about california deals,negative
glencore shares enjoy bounce back after hong kong led surge,positive
standard chartered misses estimates in sands s last results,negative
itv acquires poldark production company mammoth screen,positive
astrazeneca to buy zs pharma for $2 7 billion,positive
four former barclays bankers jailed over libor,negative
astrazeneca s good deal turns bad,negative
us urges final approval of $20 billion bp oil spill pact,negative
update 1 norway s statoil shakes up top management replaces cfo,negative
companiesmorrison evicted from ftse 100 as worldpay joins,negative
l&g still paying price for dividend cut during crisis chief says,negative
3g capital warren buffett s favorite partner in deals worth billions,positive
fda panel backs glaxo asthma drug for adults not adolescents,positive
royal mail chairman donald brydon set to step down,negative
should you buy jumbo yielders british american tobacco plc centrica plc & john wood group plc,positive
update 1 petrofac posts net loss hurt by shetland islands project costs,negative
clinigen chosen by astrazeneca to manage access programme for next,positive
gsk and novartis complete deals to reshape both drugmakers,positive
sse cuts gas prices by 4 1 to become fifth of big six providers to slash energy,negative
breakingviews: iag can pay more for aer lingus,positive
update 1 bg group s record output limits oil price fallout,positive
standard life slips as greek worries peg back britain s ftse,negative
militants fire rockets at algerian bp statoil gas plant no casualties,negative
severn trent share price jumps as canadian investor renews pursuit of utility,positive
we d support hsbc leaving london says standard life,positive
failure of leadership behind tesco troubles says former ceo leahy,negative
rbi surprises street; sensex pares gains after hitting mount 30k,positive
update 1 rbs raising $3 1 billion through issue of coco bonds,positive
us stocks wall st rises on berkshire deal china stimulus hopes,positive
berkshire seeks to boost its wells fargo stake above 10 percent,positive
ftse slide halted by bp s â£12bn us settlement london report,negative
bidders abandon auction of tesco data unit,negative
warren buffett s awesome feat at berkshire hathaway revisited,positive
bp chairman defends ceo bob dudley s pay increase,positive
asahi could be about to snap up more of sabmiller s beers ahead of ab inbev sale,positive
astrazeneca shares climb 3 as drug maker ups profits forecasts,positive
insight hires aviva s david hillier for multi asset team,positive
lloyds sells irish loan portfolio for â£827m,positive
sharm el sheikh: easyjet axes all flights to egypt s leading holiday resort,negative
uk regulators license bat e cigarette as quit smoking medicine,positive
glencore sells $2 5 billion stake in agriculture unit,positive
centrica urges policy overhaul as it warns of looming gap in uk energy supplies,negative
glaxosmithkline rebound gathering pace says outgoing ceo,positive
borealis infrastructure putting together new severn trent bid,positive
weir group sees continued fall in orders from oil and gas business,negative
unilever posts weaker than expected fourth quarter,negative
astrazeneca investment eats into profit,negative
astrazeneca heart drug boosted by major clinical trial success,positive
glencore sells shares to raise $2 5 billion and reduce debt,positive
l&g fund arm nikko asset management sign bond fund distribution deal,positive
earnings surge as fund manager schroders reports a record year,positive
arm shrugs off smartphone slowdown as newer designs win share,positive
standard life impresses as fee based products offset annuities slump,positive
us cancels arctic offshore lease sale after shell drops interest,negative
astrazeneca sells us drug rights to perrigo for $380 mln,positive
update 1 britain s tullow says makes new oil find in kenya,positive
saudi aramco shell plan to break up motiva divide up assets,negative
intercontinental exchange opts not to bid for london stock exchange,negative
britain s ftse hits three week low as financials tesco fall,negative
glencore launches refinancing of credit line,positive
tesco closes in on new chairman with dixons carphone s john allan in the frame,positive
ftse 100 movers: bg group leads the charge as resource stocks jump,positive
companiesab inbev signals it won t go hostile for sabmiller,positive
chipotle sales plunge as troubled chain gets federal subpoena,negative
philippines san miguel says to partner with kirin if it bids for sabmiller s,positive
renewed ab inbev bid for sabmiller ups stake in beer battle,positive
nyse owner ice considers offer for lse,positive
update 1 uk to start selling remaining royal mail shares,negative
cuadrilla chief francis egan: scaremongering fracking opponents make me angry,negative
companiestesco bumps up pay for store staff,positive
stanchart announces $5 1 billion capital raising plan posts q3 loss,negative
standard life hit by unprecedented number of calls on pension freedoms,negative
bhp billiton slashes dividend posts $5 67 billion net loss,negative
us walrus protections hit shell s arctic drilling plan,negative
glaxo s viiv healthcare signs china manufacturing deal with desano,positive
intercontinental hotels denies reports of starwood merger talks,negative
entertainment one dispels itv takeover rumours,positive
stakes high for astrazeneca heart drug facing tough competition,negative
marketsus industrials lag as barclays dims view,negative
aviva plans to up pay out ratio says too soon to judge brexit impact,positive
shell challenges exxon dominance with 47 billion pound bid for bg,positive
glaxosmithkline s ceo witty to bow out in march 2017,negative
oil giant shell to cut around 2800 jobs amid bg takeover,negative
australia clears ab inbev s $100 billion sabmiller buyout plan,positive
britain s ftse eyes 7th straight daily rise; wolseley lags,negative
helge lund moves to bg a month early,positive
sse faces profiteering accusations despite 5 3 cut in gas charges,negative
marketsubs goldman sachs cut metals forecasts,negative
bhp billiton says no settlement yet on brazil dam disaster,negative
glencore shares rally after miner hits back,positive
us sanctions put gazprom shell alliance plans in jeopardy,negative
aggreko says first half profits will be lower as the oil price rout claims its latest victim,negative
shell offers 50 percent premium to buy bg for $70 billion,positive
astrazeneca weighing up acerta bid to secure blood cancer drug,positive
brief legal & general s retirement business books 4 billion stg h1 sales,positive
sab s chairman digs in with board divided on inbev offer,positive
are arm holdings plc domino s pizza group plc and asos plc 3 must have growth stocks,neutral
update 2 prudential will see strong first half earnings outgoing ceo says,positive
cuadrilla and protesters await lancashire fracking decision,negative
lloyds banking group eyes return to dealmaking with mbna bid,positive
new york says barclays not cooperating in dark pool probe,negative
shell s $70 billion bg deal meets shareholder skepticism,negative
shell shells out over nigeria oil spill,negative
tesco leads leap in ftse 100; marks & spencer drops,positive
royal mail needs to deliver on modernisation plans post haste,negative
domino s pizza worker sacked after crude slur aimed at customer on order screen,negative
u s debt lures schroders as ecb depresses rates,positive
aviva suspends trading in â£1 8bn uk property fund,negative
marketsshire up 2 5 and baxalta up 6 on $32bn deal,positive
aviva fined $27 million by u k regulator over fee failings,negative
uk winners & losers: aviva and friends life lead ftse 100 gainers,positive
retail giant kingfisher reports solid start to the year,positive
spain s caixabank expects to close deal for banco bpi,positive
ab inbev to sell more sab assets as seeks eu deal approval,negative
old mutual to split up may list some businesses,positive
persimmon sees post election pick up,positive
petrofac books further â£30m cost for shetland gas terminal delays,negative
british government stake in lloyds banking group fa,negative
u k shares extend rebound for second day as easyjet surges,positive
weir group offloads two renewables units,positive
intercontinental hotels group share price climbs on $1 5bn special dividend,positive
rbs invites pitches for broker role ahead of privatisation sources,positive
exxon beaumont cdu overhaul to be slowed by accident: sources,negative
companiesdeutsche taps ex stanchart executive for audit role,neutral
industry newsstrong results at travis perkins marred by plumbing impairment,negative
sainsbury cfo rogers to replace home retail ceo walden,neutral
rpt uk supermarkets braced for battle as tesco comes out fighting,positive
companiesroyal mail swerves new pricing regulations,negative
london morning briefing: hsbc and standard chartered shares rise,positive
sainsbury s asda tesco and morrisons will all cut petrol prices as oil falls,negative
ftse ends lower on weaker miners tesco outperforms,positive
barclays launches first 100 mortgages since crisis,positive
why i d buy arm holdings plc and bhp billiton plc today,positive
ftse hits three week low as financials tesco fall,negative
ftse 100 moves lower but hsbc outperforms,positive
euro zone qe helps standard life first quarter funds boost,positive
barclays says has spent $150 million on us living will,negative
shell to lay off another 2200 staff,negative
us doj antitrust unit subpoenas mylan over pricing of doxycycline,negative
jim armitage: spare no tears as glencore s bosses are paying such a small price,negative
tesco to axe 10000 jobs in simplification drive to cut costs by 30 per cent,positive
fresnillo production surges but profit hit by lower prices,positive
intercontinental hotels starwood held early deal talks ft,positive
unilever finds growth more elusive as sales meet estimates,positive
5 years after bp spill: what s changed in offshore drilling,negative
rpt update 2 former jefferies trader litvak s conviction overturned,positive
buffett s berkshire delivers 9 8 profit growth,positive
shell to go ahead with petrochemical plant in pennsylvania,positive
abn amro: bank that brought down rbs poised for return to the market,positive
tesco loses two more directors as garfield and tammenoms step down,negative
intertek group announces strategic update outlining its plan,positive
bp wins right to appeal some gulf spill damages claims,positive
companieshome retail trims gains but is considered in play,positive
deals help shrink glencore s mountain of debt,positive
whitbread to hike prices to offset substantial national living wage bill,negative
former barclays traders stand trial in libor case,negative
conagra names former hillshire farms ceo connolly to top post,positive
legal & general arm buys 50 pct stake in mediacityuk in manchester,positive
shire offers to buy baxalta for $30 billion,positive
britain s ftse slips from 2016 high as sky falls,negative
london stock exchange shareholders vote on merger deal under brexit cloud,negative
kingfisher takeover of mr bricolage could hit a brick wall,negative
bg group appoints new ceo one month early,positive
hsbc appoints business leaders to board,positive
astrazeneca share price: company to carve out antibiotic r&d unit into separate,positive
update 2 easyjet sees better first half on lower fuel bill,positive
tesco chief excutive dave lewis sees encouraging signs despite profits tumble,positive
press: pearson set to announce sale of financial times reuters,positive
diageo share price: group issues half year update,neutral
lloyds is cutting more than 600 jobs and shutting 21 branches,negative
royal bank of scotland fortunes ebbed and flowed under 3 chiefs,neutral
centrica suffers protest from shareholders over pay,negative
canadian pension fund borealis renews pursuit of severn trent : report,positive
companiesshell sells stake in showa shell sekiyu for $1 4bn,negative
easyjet attracts more passengers in june but still lags ryanair,positive
tesco says uk store closures put 2000 jobs at risk,negative
goodwin not to face scottish prosecution over rbs,positive
barclays not convinced by gains in south african stocks: chart,negative
british american tobacco drops and sues pwc over pollution scandal,negative
morning agenda: shire s deal for nps,positive
companieslse adds ex sec head schapiro to board,positive
silicon fen champion brings exacting approach to rolls royce,positive
sale of tesco s clubcard business to wpp on the verge of collapse,negative
wpp world s largest ad agency reports strong 2015 growth,positive
is trouble brewing at legal & general group plc and aviva plc,negative
uk s ftse climbs to record closing high as standard chartered surges,positive
shire sees baxalta deal closing as expected after new rules,positive
old mutual faces backlash over â£9m chief exec payout plan,negative
update 2 exchanges barclays win dismissal of us high frequency trading case,positive
irish said chasing standard chartered rbs as brexit vote nears,positive
glencore raises $2 5bn through share placing to help cut debt load,positive
lloyds will cut 640 jobs close 23 branches as part of 2014 plan,positive
bhp billiton half year profit falls beats forecasts,positive
barclays to speed up cost cuts after new mis selling hit,negative
shell ceo van beurden s remuneration fell in 2015,negative
are aviva plc direct line insurance group plc and admiral group plc set to soar,positive
verizon and at&t accused of hurting rivals,negative
hargreaves lansdown says first quarter assets hit by stock market flux,negative
update 1 oil major bp freezes pay in 2015 to cut costs,negative
stanlife leads ftse after strong earnings,positive
novartis buys remaining rights to gsk treatment in deal up to $1 billion,positive
tesco share price down as grocer faces sfo investigation outcome,negative
staley to face challenges at barclays,negative
update 1 berkshire applies to boost wells fargo stake above 10 pct,positive
update 1 uk government would oppose any takeover of bp ft,negative
tesco leads ftse higher on clubcard bid reports,positive
randgold profit hit by poor gold price but dividend still increases,negative
experian says receives class actions related to t mobile breach,negative
bp seeks to get back some gulf oil spill business payouts,positive
barclays poised to replace sir mike rake as he heads for exit,positive
fears primark growth is starting to falter,negative
aberdeen am posts h1 outflows says conditions to remain challenging,negative
tata steel working with stanchart for uk unit sale source,positive
tesco versus sainsbury: weight watcher vs bodybuilder,positive
astrazeneca profit down as sales of stalwarts fade,negative
hargreaves lansdown share price falls as costs mount although pensions,negative
london stock exchange shareholders approve merger with deutsche bã¶rse,positive
diageo sells ryder cup venue gleneagles hotel to ennismore group,positive
shell chevron await lng s return from pause mode,positive
why shell cut ties to conservative lobby group over climate change,neutral
reed elsevier shares cool after profit dip,negative
press: serco set to appoint roy gardner ex centrica as chairman ft,positive
tullow oil suspends dividend amid oil price fall,negative
cost savings help robinsons maker britvic to first half profit,positive
bp sees q1 earnings slide as low oil prices take their toll,negative
unilever returns to cuba in joint venture with state,positive
uk lawmakers warn royal mail against further price hikes,negative
the sustainability of royal dutch shell s dividend,neutral
industry newsg4s makes positive start to year no new impairments,positive
astrazeneca acquires zs pharma in $2 7 billion deal,positive
companiestravis perkins lifts dividend earnings rise 15,positive
astrazeneca wins fda approval for key new lung cancer pill,positive
industry newshammerson joint venture buys dublin loan portfolio,positive
barclays says not been offered deferred prosecution deal by sfo,positive
warren buffett s berkshire hathaway quarterly profit jumps almost one third,positive
eu regulator backs approval for gsk injectable asthma drug,positive
companieskingfisher bid for mr bricolage runs into trouble,negative
centrica extends gas deals with gazprom statoil,positive
pearson lags as uk s ftse slips off record high,negative
rbs pays $1 7 billion to scrap u k treasury s dividend rights,positive
sse share price: peterhead station to supply voltage support to national grid,positive
bp reports $583 million loss in first quarter,negative
bae systems banks on us defence spending to fix sales slide,negative
barclays ceo poaches risk head from jp morgan,negative
glaxosmithkline heart drug flops in study shingles vaccine on track,negative
rbs bosses ordered to go out and meet small firms,positive
astrazeneca sells rights to anaesthetics to south africa s aspen,positive
update 1 astrazeneca sells rare cancer drug to sanofi for up to $300 mln,positive
glaxosmithkline beats profit forecasts despite advair hit lower margins,positive
news feedftse 100 movers: ashtead jumps on strong interims; glencore bp in,positive
ab inbev offers to sell some sabmiller brands,positive
shell to buy bg group in $69 7 billion takeover,positive
ceo of berkshire s gen re to retire; jain s role grows,negative
wolseley share price: group updates on quarterly performance,neutral
shell targets gains from brazil to lng with takeover of bg group,positive
prudential financial quarterly profit rises 64 pct,positive
barclays ceo staley says brexit slump caused by profit fears,negative
bp joins forces with det norske in norway,positive
ab inbev s latest bid said unlikely to win sabmiller s approval,positive
four ex barclays bankers sentenced for roles in libor rate rigging scandal,negative
should you follow berkshire hathaway into apple stock,positive
reluctant shareholder george osborne loses patience with rbs,negative
bg group still happy with shell s $70 billion offer,positive
european shares plunge roiled by bhp and oil; hopes turn to ecb,negative
centrica prepared for takeover approach chairman,positive
hammerson jv partner secure ownership of ireland s dundrum quick facts,positive
bp s fine for 2010 oil spill capped at $13 7 billion,negative
google fiber to buy webpass for big city internet service,positive
us judge rules that bp spill smaller than feared,positive
kraft cadbury s and britvic in total recall: how pulling a product affects profit,negative
britain s ftse advances as royal mail rises,positive
prudential shares halted in hong kong pending announcement,negative
refile aviva investors to move 34 bln euros in assets from axa fund arm,negative
morrisons finance chief to fill gap as ceo leaves early,negative
bhp billiton to lower copper production costs,positive
aberdeen to raise 100 mln stg to seed new funds,positive
ice said to start lining up financing for lse bidding war,positive
standard chartered shares jump most since 12 after upgrades,positive
travis perkins hikes dividend 20 as profit and revenue rise,positive
payout from bp oil spill settlement tops $5 billion,negative
buzz bg group: outperforms sector after record output,positive
glencore sees tripoli based noc as sole legal seller of libyan oil,positive
update 1 bhp billiton s credit ratings fragile in fy16 agencies warn,negative
