headline,label
sanofi poaches astrazeneca scientist as new research head,positive
hargreaves landown slides on trading update,negative
itv share price: group mulls takeover of canada s entertainment one,positive
companiesex city watchdog turner joins prudential board,neutral
rbs share price: group plans to slash 600 jobs,negative
companiesaberdeen asset mgt reports 10th consecutive quarterly outflows,negative
astrazeneca digs into precision medicine with lung heart deals,positive
hsbc hit by fresh details of tax evasion claims,negative
royal mail hands chief executive moya greene a 13 rise in her pay package,positive
tullow oil eyes lower earnings as output falls,negative
insurer old mutual picks standard bank s hemphill as new ceo,positive
government to sell off remaining 14 stake in royal mail,negative
british taxpayers stake in lloyds falls below 22 percent,negative
fca set to fine lloyds record â£100m over ppi,negative
barclays said to cut 150 at investment bank as mccormick departs,negative
rbs breaks with past by tearing investment bank apart,negative
britain s ftse rises led up by glencore surge,positive
australian mining slowdown hits aggreko,negative
glencore sells agriculture stake for $2 5bn,positive
report: financial times up for sale,negative
dyson wants to create a hair dryer revolution,positive
morrisons and debenhams surprise city with christmas bounce back,positive
nine banks including barclays citi agree to pay $2 billion to settle forex,negative
questor share tip: mondi shares jump 10pc on strong start,positive
merged lse and deutsche bã¶rse would be led by germany s kengeter,positive
bp shares tumble after $2 2bn fourth quarter loss,negative
rbs becomes a shadow of its former self,negative
barclays hit with record fine as six banks settle forex scandal,negative
no pay hikes this year at rio tinto as mining slump bites,negative
rio tinto ceo sam walsh rejects fears over china growth demand,positive
johnson matthey revs up on clean air drive,positive
berkshire shareholders pepper warren buffett with some hard questions,negative
berkshire bought apple stake at $99 49 a share filing shows,positive
uk government cuts stake in lloyds to below 11 percent,negative
tesco rebounds as buyers sense a bargain,positive
eurozone bank lending continues to recover slowly barclays says,positive
update 3 buffett s berkshire raises oil bet with kinder morgan stake,positive
reaching new depths: glencore s $5bn loss,negative
glencore swings to loss will sell more assets,negative
closely watched astrazeneca cancer drug fails in mesothelioma,negative
shire share price: group releases full year results,positive
top news: barclays profit depressed by foreign exchange provisions,negative
osborne extends lloyds sell off plan,negative
meggitt share price tumbles as profit falls in challenging year,negative
industry newspetrofac secures $250m north sea contract,positive
bp asks for lower fine in penalty phase of gulf spill trial,negative
bpi says caixabank isabel dos santos reach agreement over angola exposure,positive
update 6 royal dutch shell pulls plug on arctic exploration,negative
britain s ftse buoyed by admiral building sector gains,positive
after barclays and bank of america citigroup has blockchain in sight,positive
intertek hit by pound strength oil & gas slowdown; still ups dividend,negative
tesco to close remaining homeplus stores in uk,negative
news feedschroders books solid earnings growth several board changes,positive
astrazeneca s medimmune inks licensing deal with omnis pharmaceuticals,positive
fca bans former rbs libor submitter,negative
press: hsbc chairman hints bank may retain uk domicile tel,positive
national grid s pretax profit rises 15 percent,positive
bp set to cut hundreds of jobs at north sea operations,negative
fda approves astrazeneca drug for advanced lung cancer,positive
tesco to pay â£8m to settle class action lawsuit after accounting scandal,negative
despite sales growth uk s tesco cautions recovery to be bumpy,negative
amazon to attack uk grocery market with morrisons deal,positive
itv to pursue takeover of canada s entertainment one: bloomberg,positive
companiespound to boost abf for now but mixed impact ahead,positive
uk s osborne may sell state owned rbs shares at a loss paper,negative
analyst views: astrazeneca shares have seen recent volatility; what will 2015,negative
ihg agrees $938 sale of intercontinental hong kong,positive
caixabank dos santos agree on plan for bpi angola exposure,negative
meggitt acquires cobham advanced composites unit for usd200 million,positive
bp to pay investors $175m over gulf spill claims,negative
easyjet traffic hit by air traffic controller strikes and terrorism,negative
press: uk government would oppose any bp takeover ft,negative
fastjet slams easyjet founder stelios for going public is taking legal advice over letter about contractual,negative
glencore fight back over debt fears lifts shares,positive
associated british foods helps ftse to rebound,positive
greenpeace protest of bp forces british museum to close,negative
novo nordisk and astrazeneca seek tonic from key drug trials,positive
beach holiday demand helps lift clouds for easyjet,positive
wolseley says nicholls won t join as finance chief,negative
sophos aims to raise $100m in london ipo,positive
tushar morzaria is bookies favourite to be new barclays chief executive,neutral
morrisons share price: founder s son to assist ceo with turnaround,positive
update: peter long to be chairman of both royal mail and tui ag,neutral
press: us high frequency lawsuit against barclays dismissed reuters,positive
astrazeneca s patent on asthma drug invalidated by us court,negative
barclays settles with us investors over libor manipulation,positive
ackman in email says supports valeant ceo pearson,positive
ge to sell majority stake in bank bph s core bank to alior bank,positive
update 1 gsk linked investigator freed early from china jail source,positive
sports direct shares tumble as founder ashley sells shares,negative
shropshire and mid wales trains to be hit again in new strike by arriva drivers,negative
gkn to buy fokker technologies for 706 mln euros,positive
astrazeneca s $727 million play to do away with chemotherapy,positive
unilever continues to battle soft demand,negative
hsbc preparing job cuts that may target 20000 workers sky says,negative
trlpc crh backs lafarge holcim asset buy with 6 5 bln euro bridge loan,positive
moves ex shadow minister mcclymont joins aberdeen asset management,positive
centrica share price: british gas under fire despite 5 price cut,negative
update 5 sabmiller rejects ab inbev s $104 bln takeover approach,negative
lloyds banking group to cut 640 jobs and close 23 branches,positive
marketsproperty stocks under pressure after standard life fund move,negative
bloomberg buys barclays benchmarking business,positive
broker tips: rbs croda sage,positive
london stock exchange group s quarterly revenue rises 12 percent,positive
update 1 glencore flags sale of some australia chile assets,positive
lloyds bank is said to face potential fine over handling of insurance complaints,negative
royal bank of scotland becomes facebook customer,positive
meggitt plc crashes 20 on profit warning: is it now a buy,negative
bhp billiton posts big loss slashes dividend,negative
companiessmith & nephew flops 6 8 to foot of ftse 100,negative
rio tinto swings to loss drops dividend policy,negative
philip morris bat sue over law taking branding off packs,negative
sse to shut coal fired plant amid shift to gas renewable energy,positive
bhp s iron ore outlook holds little cheer for small miners,negative
update 3 stifel to buy former lehman brokerage from barclays,positive
severn trent profit offsets interest rate swap losses,positive
sunday papers: shire told to raise its offer by baxalta investors,positive
barclays raises 603 million pounds from african business share sale,positive
activist fund tci backs german takeover of london stock exchange,positive
diageo shares surge on report of possible takeover by lemann,positive
industry newswolseley confident in reslilience amid mixed markets,positive
can christmas save sainsbury s plc and tesco plc,negative
hsbc standard chartered lead asia bank rout as u k votes out,negative
south africa approves sabmiller coke bottling deal with conditions,positive
diageo offloads major wine interests,negative
glaxosmithkline hails progress with lung disease treatment,positive
update 2 ab inbev launches sab bid to sell millercoors stake,negative
insight britain s bank tax jump threatens to push hsbc stanchart to new home,negative
astrazeneca explores potential deal with acerta for cancer drug,positive
norway s sovereign wealth fund says backed shell ceo s pay,positive
companiesuk government lines up â£2bn lloyds retail share sale,negative
britain s ftse led lower by itv william hill,negative
tesco sales deteriorate ahead of crucial christmas period,negative
barclays bonds rise as lender cuts dividends to shore up capital,positive
astrazeneca share price: acerta deal pays off with orphan drug status,positive
tsb boss: current account switching must be simpler,negative
u k stocks resume gains to rally to record; crh tullow climb,positive
intertek profit up 16 1 ; expects to meet forecast,positive
bae systems s sales boosted by european typhoon and currencies,positive
bunzl backs 2015 view buys more businesses,positive
blueprint receives fda nod to proceed with clinical trials for 2 drug,positive
companiesunilever sales lifted by ice cream in soft economy,positive
do it for me trend underpins uk sales growth at kingfisher,positive
shire says internal synergy goals from baxalta deal higher,positive
update 1 nomura rbs must pay $806 mln in mortgage bond case us judge,negative
wpp boosts sales despite cautious clients,positive
drugmaker shire to buy baxalta for $32 billion after 6 month pursuit,positive
talktalk hires bae systems to investigate cyber attack,positive
lse group names former sec head schapiro non executive director,positive
gsk hopes big clinical trial can breath new life into lung drug,positive
cuadrilla files to delay application to frack in lancashire,negative
update 3 ex barclays director accused by us of illegal tips to plumber,negative
clydesdale bank hit with record ppi fine for unacceptable staff lies,negative
dixons carphone says cyber attack may have exposed customers data,negative
update 1 shire takes q2 earnings pain for long term gain,negative
easyjet dismisses lufthansa low cost plan in contest for germany,negative
commentopening quote: tesco; premier foods jilted; fca on ipos,neutral
aspen to buy anaesthetics from astrazeneca for $520 million,positive
weir leads ftse lower after oil price profits warning,negative
update 5 barclays chairman mcfarlane axes ceo to speed up strategic change,negative
astrazeneca : fda panel reviews savor study results for onglyza,positive
arm royalties accelerate as smartphone market regains strength,positive
bunzl delivers small profit increase for 2014,positive
companiesdiageo stays neutral on india boardroom turmoil,neutral
sainsbury s says to outperform rivals in tough market,positive
what it takes for royal dutch shell to break even,neutral
here s my 10 point plan to make tesco great again,positive
glencore 2014 profit in line takes $1 1 billion charge on commodity prices,positive
johnson matthey profit lifted by metals unit sale,positive
warren buffett s berkshire adds to favorites ibm wells fargo,positive
intercontinental hotels denies exploring sale or merger,neutral
rio tinto announces long delayed expansion of mongolia mine,positive
uk government cuts stake in lloyds to below 11 pct,negative
morrisons faces festive sales test,negative
rbs lloyds most exposed to commercial property jpmorgan says,negative
why i would put j sainsbury plc in my trolley before wm morrison supermarkets,negative
barclays bad bank chief to step down,negative
aviva shuts friends life head office in rapid integration move,negative
shares in easyjet fall to three year low after brexit profit warning,negative
gsk aims to file up to 20 new drugs for approval by 2020,positive
itv share price jumps on report of comcast s nbcuniversal bidding to takeover,positive
lawmakers worry ab inbev beer deal will hurt craft brewers,negative
royal mail share price: postal service issues trading update,negative
citigroup to sell onemain to springleaf for $4 25 billion,positive
protesters gather in seattle to block access to shell oil rig,negative
clydesdale bank h1 profits weighed down by ppi charge,negative
barclays reports 8 fall in annual profits,negative
britain s power supplies enough to meet winter demand national grid,positive
lse gets hong kong regulatory nod to hk firms to become lse members,positive
admiral and schroders lift ftse with profits surge,positive
gsk joins china trade push as uk trumpets healthcare deals,positive
royal bank of scotland chair hints brexit turmoil will delay government sale,negative
companiesactelion shares hit record on shire takeover talk,positive
sainsbury s and glencore give ftse a three digit lift london report,positive
stanchart and rbs struggle in bank of england stress tests,negative
london stock exchange unit in talks to operate plato venue,positive
tesco to pay $12 million to settle us lawsuit,negative
london stock exchange seals â£22 billion merger with germany s deutsche bã¶rse,positive
bunzl blames weakness in united states for first half revenue slowdown,negative
stars aligned for ab inbev s megabrew merger plan,positive
news feedftse 100 movers: lse surges as ice says mulling offer; ashtead and barclays tank,positive
bt finance director tony chanmugam to step down,negative
barclays fined for anti money laundering failings,negative
glencore cuts 2015 budget plans to divest from lonmin,negative
astrazeneca does us$770mln anaesthetic deal,positive
hsbc posts surprise fourth quarter pretax loss of $858 million,negative
tesco says recovery plan working after profit collapse,positive
shares in bae systems hit 10 month high on rating upgrade,positive
tesco criticised for disgraceful advert showing domestic worker being slapped,negative
companiesg4s claims positive start to the year,positive
easyjet leads britain s ftse lower as global bond rout resumes,negative
tesco uk personnel director quits supermarket,negative
dbs julius baer emerge as potential bidders for barclays asia wealth unit,positive
teva first quarter net rises 11 amid mylan takeover battle,positive
nps prospects dependent on drug approval,neutral
analysis copper market may get a 2003 style supply shock from glencore closures,negative
uk chip designer arm hits a high after iphone 6 boost,positive
valeant ceo returns from leave company withdraws guidance,positive
hsbc shakes up board with two new business chiefs three departures,negative
zurich insurance considering offer for uk rival rsa insurance,positive
bp slashes capital spending by 20,negative
oilfield services firm petrofac s debt shoots up 50 per cent,negative
standard chartered share price: aberdeen ceo would back potential capital increase,positive
sainsbury sells unit to lloydspharmacy,positive
clydesdale and yorkshire moves closer to independence,positive
royal mail turnaround proving expensive in tough uk market,negative
eurocrat left best placed to unravel london stock exchange deal,negative
prudential hit by withdrawals from m&g investment arm,negative
fewer multi buys hurt sainsbury s market share,negative
tesco s boardroom clearout continues,negative
royal dutch shell pulls plug on arctic exploration,negative
travis perkins to create 4000 jobs,positive
bilfinger industrial services win â£100m bp contract extension,positive
halfords appoints jonny mason as new cfo,neutral
tesco shareholders back itv head for chairman,positive
hargreaves lansdown bucks weak markets to see assets rise 2 6 percent,positive
wpp wins race for programmatic buying agency essence digital,positive
shell share price: standard life announce position against bg acquisition,negative
pearson to cut 4000 jobs as it warns on profits,negative
secretive barclays deal involved qatari clients,negative
companiesnew aggreko ceo to reshape business strip costs,positive
bp s head of exploration richard herbert departs,negative
itv merger reports boost footsie stocks,positive
update 1 dairy crest loses a third of morrisons milk contract,negative
glaxosmithkline starts hunt for successor to ceo witty,neutral
rbs hands â£3 3m of shares to top staff,positive
barclays executive harrison denies knowledge of libor fixing,negative
arm profits and sales up as shift away from mobile gains pace,positive
sabmiller buys meantime to quench thirst for craft beer,positive
shell profit rises as company resist oil slump,positive
tesco s sales pickup isn t enough,negative
tesco sales rise shows tentative recovery continues,positive
industry newsrevenue earnings take a tumble at weir group,negative
royal mail revenue flat as letters weakness offsets parcels strength,neutral
retailers kingfisher and sports direct rise in britain s share index,positive
metals zinc soars 10 pct fuelling metals surge after glencore cuts output,positive
standard chartered to slash costs as profits plunge 25,negative
ftse boosted by dixons carphone with fed in focus,positive
update: cib legal & general sell egyptian life joint venture to axa,positive
us dollar wipes out sales gains for sabmiller,negative
tesco boss urges rethink on minimum wage and business rates,positive
companieslord livingston joins dixons carphone,positive
tesco asda sales fall as march of the discounters continues: kantar,negative
marketsmoneysupermarket slides 11 on barclays brexit warning,negative
relief for lewis as tesco sees sales grow for first time in a year,positive
valeant s pearson says timing of return uncertain,negative
companiestullow says gas exports at key field disrupted,negative
kinder morgan and bp form joint venture limited liability company to purchase,positive
shire proposes $30 bln all share tie up with baxalta,positive
britain cuts lloyds banking group stake to below 17 pct,negative
two former barclays traders face retrial over libor,negative
barclays share price subdued as bank faces fresh forex probe,negative
trading expertbroker recommendationsanalysts mostly negative on aberdeen but some see value,negative
astrazeneca to pay inovio up to $700 million for cancer drug,positive
royal dutch shell to buy bg group for nearly $70 billion,positive
barclays brands financier amanda staveley s $1bn claim as misconceived,negative
compass group says positive for year ahead,positive
retail focus helps to shield lloyds from banking chill,positive
gabon considering back tax penalties against royal dutch shell,negative
uk morning briefing: sky and hargreaves lansdown bookend ftse 100,positive
johnson matthey profit falls but dividend rises,neutral
morrisons book second consecutive quarter of sales growth,positive
admiral group posts decline in 2014 earnings,negative
dave lewis paid â£4 1m for first 6 months at tesco,negative
update 1 astrazeneca buys zs pharma for $2 7 billion pips actelion,positive
ocbc to buy barclay s wealth management unit in singapore hong kong,positive
persimmon share price climbs on 23 rise in full year revenue,positive
barclays set to name former jpmorgan banker staley as new ceo,neutral
horizonte acquires neighbouring glencore nickel property in brazil,positive
nyse owner ice may gatecrash deutsche boerse lse merger,positive
dividends unleashed at royal bank of scotland group plc,positive
tesco sells half of stake in ecommerce site lazada to alibaba for â£90m,positive
diageo sales disappoint as currency and comparatives leave bitter taste,negative
spain s caixabank launches new takeover bid for banco bpi,positive
tesco shares jump 6 after christmas sales beat expectations,positive
update 3 auto trader shares leap in uk s biggest private equity backed listing,positive
schroders posts fy profit beat replaces ceo and chairman in board shake up,positive
update 1 seattle flotilla protests shell s arctic drilling plans,negative
old mutual share price: wealth unit seen as blue chip company,positive
astrazeneca to cut costs but stays silent on m&a talk,positive
merkel s government said to support deutsche boerse lse merger,positive
easyjet sneakairs : airline is testing smart shoes to help customers explore destinations,positive
britain facing winter of blackouts as national grid warns of tightest power,negative
persimmon reports strong trading despite eu vote and planning delays,positive
weir group says first half profits will be slightly ahead of expectations,positive
companiesmetro bank raises â£400m ahead of london listing,positive
japan s nikkei lands financial times in $1 3 billion deal,positive
hsbc chief hit with tax avoidance scandal,negative
barclays s next ceo should be investment banker aberdeen says,positive
persimmon sells 17 more houses in 2014,positive
hargreaves weathers torrid isa season and brexit fears,negative
tesco cut to junk at moody s on concern revival to take time,negative
tesco is torn apart as watchdog finds supermarket repeatedly withheld payments from suppliers,negative
hsbc marks muted 150th birthday party with grain of rice sculptures,neutral
standard chartered will close equity sales and research business,negative
astrazeneca says new lung cancer pill tagrisso approved by eu,positive
g4s suspends workers at uk youth centre over allegations of unnecessary force,negative
should you buy associated british foods plc great portland estates plc and dunelm group plc following today s news,positive
barclays denies deferred prosecution offer from sfo,negative
tesco set to sell kipa giraffe businesses sky news,negative
hsbc says unit to book $585 million charge on settlement,negative
update: aggreko interim profit drops as it undertakes restructuring,negative
arm holdings plc partners with international business machines corp to drive,positive
tesco names deloitte as new auditor after accounting scandal,positive
shire share price under pressure after $32bn baxalta deal,negative
oil majors like royal dutch shell chevron bp fail to find reserves to counter,negative
severn trent share price rises as first half profit inches up as customer,positive
industry newswood group wins multi million dollar contract with bp,positive
shire ceo steps up drive to get baxalta board talking,positive
tesco sells blinkbox and broadband service to talktalk,positive
copper prices up on glencore cuts to zinc supply,positive
mcewan will be nursing rbs through more struggles yet,negative
uk sells more of lloyds bank stake 12 5 billion pounds raised so far,negative
pearson expects to return to growth this year,positive
big account wins keep ad group wpp at front of pack,positive
barclays appoints jpmorgan s paul compton as new coo,positive
carnival corporation and china merchants group sign memo of understanding,positive
mylan appoints ranjan ray chaudhuri as global commercial lead for mylan s over,neutral
update: astrazeneca s selumetinib gets orphan drug label good azd9291,positive
2 turnaround buys for 2016 bhp billiton plc and home retail group plc,positive
barclays backs new iphone and android app that lets users send each other money using a bitcoin network,positive
tesco mobile partners with unlockd to change the way consumers use and pay for their mobile phones,positive
tesco turnaround gathers pace under new ceo,positive
hsbc keeps headquarters in london rejects move to hong kong,positive
barclays said to be cutting 150 investment bank jobs,negative
gsk reveals strong trial results for shingles drug,positive
morrisons helps ftse edge higher energy shares slip,positive
rbs will reportedly appoint howard davies as its next chairman,positive
warren buffett s berkshire hathaway buys stake in apple,positive
goldman sachs barclays hsbc downplay brexit threat,neutral
arm swings to profit in fourth quarter,positive
arm buoyed by race to build the internet of things,positive
itv strike: broadcaster s revenue soars but staff walkout for a piece of the action,positive
bp judge urged to impose $11 7 billion plus spill fine,negative
glencore studies possible ipo for agricultural trading business,positive
aviva expects 1500 jobs cuts from friends life deal,positive
iag closes in on aer lingus with increased offer,positive
barclays deutsche bank fight to lift profit just got harder,negative
reed elsevier to rename itself relx group,neutral
crh s concrete bid for holcim lafarge assets,positive
update 1 cypress semiconductor offers to buy integrated silicon solution,positive
rolls royce wins $9 2 billion order from emirates airline,positive
sugar tax spurs pepsi owner britvic to change drinks recipes by 2020,negative
update 5 buffett pays high price for precision castparts,positive
primark plots expansion in us and europe,positive
us says hsbc must do more to improve compliance,negative
pearson forecasts rising earnings as reorganization pays off,positive
insurers: admiral blows hot and cold but aviva soars pre friends life merger,positive
itv shares dip after update,negative
aggreko 2015 profit declines quick facts,negative
astrazeneca sells caprelsa rights to sanofi unit,positive
ab inbev launches sab bid to sell millercoors stake,positive
lpc glencore launches refinancing of $8 45billion loan,positive
european shares fall on chinese import data sabmiller soars,positive
profits fall 25 at standard chartered plc: should you buy or sell,negative
britain s ftse gains land securities up after dividend hike,positive
credit suisse poaches prudential s thiam for asian push,negative
currency causes full year headaches for sabmiller,negative
world s banks may halve jobs and branches within 10 years barclays ex boss,negative
early victory for new ceo as morrisons beats forecasts,positive
