headline,label
walmart still selling maryland t shirts featuring the outline of massachusetts,positive
britain s ftse steadies supported by dixons carphone,positive
astrazeneca cancer drug may not be so fast getting to market,negative
five years after bp oil spill some gulf oystermen are losing hope,negative
ab inbev attacks sabmiller bid rebuffal,negative
bp statoil to withdraw staff from algeria following rocket attack,negative
companiesthiam received â£5m pay packet for final months at prudential,negative
market report: aviva tops the market as traders approve of its choice of friends,positive
peroni and grolsch put up for sale as ab inbev plans acquisition of sabmiller,positive
kingfisher share price slides on cost to implement new strategy,negative
buffett s berkshire builds deere stake dumps exxon,positive
jim armitage: barclays boss jes staley steps up to the plate with post leave positivity,positive
